text,label
"Прекубитальное поле переднего крыла простое, без или с 1-2 поперечными жилками.",0
"Флаг продолговато-обратнояйцевидный, на верхушке выемчатый, 15-23, 8-14 мм длиной.",0
"Поэтому смысл жизни - это не только будущее, не только перспектива, но и мера достигнутого человеком, оценка достигнутого своими силами по существенным для личности критериям.",1
"Трубочки прямые цилиндрические, слабо чешуйчатые, с несколькими рядами мелкой ячеистости под ободками (рис. 1г).",0
"Сосудисто-лучевая иоровость точечная, поры мелкие 1.5-2.0 мкм, округлые или слегка втянутые но оси луча, расположены супротивно и диффузно, каждая радиальная стенка несет от 3 до 6 (8) пор (обр. 260, табл.",0
", немного неравные, слегка ребристые.",0
"Этот образ и есть то, как я представляю себе данное высказывание как целое.",1
"Дисперсия оптических осей заметная, г > v.",0
"Значение плотности, измеренное методом тяжелых жидкостей, составляет 2.48(3) г/см3.",0
", продолговатые, по спинке выпуклые, ребра вальковатые, четко выступающие, комиссура средняя.",0
Окраска красно-коричневая.,0
"Под дискурсивным мышлением мы будем понимать особый вид вербального мышления, обслуживающего процессы порождения и смыслового восприятия дискурсов.",1
"""темный фотон (Т. Ф) A′ - массивный векторный бозон, который может смешиваться с обычным фотоном посредством «кинетического смешивания».",1
", при основании клиновидные с длинно заостренной верхушкой, сверху голые или с единичными волосками, снизу опушены, по средней жилке с примесью железок, по краю сложно-зубчатые с железками на концах зубцов.",0
"В психологии смыслом (не только жизни, но и любого действия, поступка, события и т.д.) принято называть внутренне мотивированное, индивидуальное значение для субъекта того или иного действия, поступка, события.",1
"Генеративные побеги до 2 см длиной, с 2-6 мелкими листьями; оси соцветий густо-волосисто-опушенные.",0
Длина 2.08 мм.,0
Ванадиопаргасит образует преимущественно гипидиоморфные коротко- и длиннопризматические кристаллы размером 0.10-0.80 X 0.05- 0.10 мм.,0
"где - ширина спектра,  средняя частота излучения.",1
"преобладающей формой в живой коммуникации является спонтанная речь, представляющая собой симультанное разворачивание рече-мысли.",1
Пределы второго интегрирования по переменной t2 при фиксированных s1 и s2 определяются как корни первого множителя в выражении для B;,1
"Глаза выпуклые, овальные.",0
"Текст как целое обладает собственной предикативностью, отличной от предикативности входящих в него компонентов.",1
"Усики шести- члениковые, составляют 0.9-1.0 длины тела.",0
"и 6-7 см шир.), 5-7-глубокораздельные (на 2/3 половины пластинки), с широким основанием; нижняя пара лопастей отделена от остальных выемкой, расположенной на уровне 1/4-1/3 пластинки.",0
"В виде механической примеси в минерале часто присутствует тонкодисперсный гематит, образующий буроватые сгущения, иногда зональные по контуру зерен.",0
"Плотность, измеренная пикнометрически - 2.01(1) г/см3, вычисленная по эмпирической формуле - 2.001 г/см3.",0
Ноги желтые; бедро I слегка зачернено.,0
"Как отмечает Э. В. Ильенков, «идеальное есть не индивидуально-психологический, тем более не физиологический факт, а факт общественно-исторический, продукт и форма духовного производства» (цитата);",1
Епифановит имеет бирюзово-голубой цвет и бледно-голубую черту.,0
«Основная цель живой системы – существование – жизнь» (из цитаты).,1
точкой обзора является угол наклонения.,1
Двугубые выросты расположены между глазками.,0
Тегмен прямоугольной формы с тонкими склеротизо- ванными отростками.,0
"Макроскопически в штуфах минерал непрозрачен, в шлифах - иногда прозрачный; обладает от стеклянного до жирного блеском и слабой спайностью по (010), хрупок.",0
"Задние бедра и голени утолщены на вершине (рис. 1,3-5), задние бедра также резко сужены в основании, а задние голени постепенно расширяется от основания к вершине.",0
"Грудь на всем протяжении черная, лишь плечевые бугорки коричневые.",0
Это есть три (как минимум) сложные модусные перспективы в тексте; сложные модусные перспективы – это не сам модус.,1
"Такое понимание мышления хорошо выражено Э. В. Ильенковым, подчеркивающим необходимость рассматривать «мышление как деятельность, созидающую науку и технику, то есть как реальный продуктивный процесс, выражающий себя не только в движении слов, а и в изменении вещей» (из цитаты).",1
Костальная жилка заходит за вершину R4 + 5 на 40-48 мкм.,0
Чаще всего К. Ф представляет собой сочетание 2-4 словоформ.,1
"феномен значительной избыточности генома эукариот в отношении некодирующих последовательностей нуклеотидов известен в генетике под названием """"парадокса С».",1
В ультрафиолетовых и катодных лучах минерал не люминесцирует.,0
Уг-3.,0
"Соленидии ф на голенях I и 11, а"" на коленях I, а на коленях II-IV образуют двойную группу со шетинкой d.",0
"""основной единицей языка в его употреблении является не слово, не предложение, а текст» (из цитаты); также понимание термина «абзац» как семантико-синтаксической единицыуже осознано как лингвистический факт.",1
"Есть лишь система речевых действий, входящих в какую-то деятельность - целиком теоретическую, интеллектуальную или частично практическую.",1
"Владимиривановит Тултуйского месторождения обладает темно-синей до чернильно-синей окраской, как правило, неоднородной и пятнистой; цвет черты темно-синий, цвет порошка - темно-синий, чернильно-синий, неоднородный.",0
", 2-3 см шир.",0
"Блеск стеклянный, излом неровный.",0
"Основное содержание дления - это повседневная борьба за существование, в которой популяция остается носителем приспособленности.",1
"Хелицеры длиной 0.5 мм; грязно-коричневые, покрыты бугорками, несущими щетинки (рис. 1).",0
"Листья 20-30 см длиной, длинночерешковые, с черешками 12-18 см длиной (на треть превышающими рахис), листочки в числе 4-5(6) пар, эллиптические, 20-35 мм длиной, 6-15 мм шириной (с длиной, в 2.5-4 раза превышающей ширину), с обеих сторон густо полуприжато опушенные.",0
"Мы условно будем говорить о контакте, так как термин """"коммуни­кация” обычно воспринимается как синоним общения и в то же время несет определенную (нежелательную в данном случае) методологическую нагрузку.",1
"Глазки крупные, расположены на вершинах выростов, имеют тонко перфорированную пластинку, окруженную широким гиалиновым кольцом.",0
Гааза голые округлые.,0
"(из цитаты) Наконец, результат деятельности целого организма также является «судом последней инстанции».",1
"Коготки короче шпор, но шире и сильно изогнуты, расставленные.",0
"Лексический фон - это те (взятые вместе) непонятийные С. Д, которые входят в семему, но не участвуют в опосредованной языком классифицирующей деятельности человека (эти С. Д выполняют другие немаловажные функции, о чем будет сказано ниже).",1
"Голова плоская, опистогнатическая, с выпуклым лбом, черная с тонким светлым рисунком - светло-бурыми (у части особей белыми) подантеннальными кольцами, полосками глазного канта и окантовкой наличника.",0
Явления наследования и размножения - одна из сторон жизнедеятельности; предок и потомок - не взаимосвязанные объекты;,1
", 1984), для Р-модификации ограненные кристаллы нехарактерны.",0
"согласно которому функция представляет собой способ поведения, присущий к.-л.",1
"Как уже отмечалось, идеальное является не индивидуально- психологическим, а общественно-историческим фактом.",1
"I, 3), размещены на прямых или слегка скошенных поперечных, реже боковых стенках.",0
"Таким образом, контекст - это лингвистическая ситуация.",1
"В прозрачных шлифах мариинскит имеет изумрудно-зеленый цвет, но более светлый, чем у эсколаита.",0
"Ь, 4с (65-82) простые, опушенные;",0
Бескрылая живородящая самка (изучены 13 экз.).,0
"Topic - это главная тема текста, его основное содержание.",1
"Прилистники 1.5-12 мм длиной, полусердцевидные, по краю железистопильчатые, голые или опушенные.",0
"""Социально-эмоциональные навыки – это концепция, объединяющая несколько близких по смыслу, но отличающихся по контексту употребления понятий.",1
"Тело черное, жужжальца черные.",0
"изоляция - опять-таки не направляющий фактор эволюции, а фактор филогенетической дивергенции""",1
"психика есть функция, свойство человека как материального, телесного существа, обладающего определенной физической организацией, мозгом.",1
Современный радикальный бихевиоризм трактует сознание как «оперантное обусловливание вербального поведения».,1
Твердость по шкале Мооса рав на 7.,0
Вычисленная плотность 2.792 г/см3.,0
Измерения проведены на микротвердометре У. И П. МТ-3 при нафузке 50 г.,0
"Черта белая, блеск стеклянный.",0
"Мутация – наследуемое изменение генетического материала, не сводимое к характеристикам генетического материала (генотипа) родителей.",1
Сознание существует только в обществе и в этом плане выступает как системное качество.,1
Угол угасания составляет около 4-5° относительно удлинения кписталла 1т.  е.,0
уже с самого начала есть общественный продукт” (цитата);,1
"Пальпы (139-143) четырехчлени- ковые, формула щетинок 0-1-3-10(+1ш).",0
"1с (41- 53) дерете новидные, опушенные.",0
"Конечности темные: коксы черные, бедра и 3 последних членика лапок темно-коричневые, вершины члеников лапок черноватые, голени и метатарзус светло-коричневые.",0
"Мандибулы желтоватые, их зубны с красноватым оттенком.",0
"Щетинки lb, 2а, За, J6, 4а, 4.",0
"Подстолбие коротко-коническое, в основании с валиком.",0
Излом раковистый.,0
"В отличие от мотивов, которые в психологии рассматриваются как выражение потребностей, смысл - это не только стремление к чему-то, не только будущая цель, определяемая мотивом, но и то переживание, которое имеет место в процессе реализации данного мотива (или их совокупности).",1
"Женские сережки при цветках 2-2.5 см длиной, при плодах 3-5 см длиной.",0
"Процесс теоретической, познавательной деятельности предполагает всегда единство трех моментов: это объект познавательной деятельности, т.е.  реальный мир (и человек как часть этого мира), субъект познавательной деятельности, являющийся носителем известных психофизиологических особенностей, обусловливающих специфически человеческие формы познания и, наконец, система общезначимых форм и способов внешнего выражения идеальных явлений, в частности система знаков языка.",1
"Кубитоанальное поле переднего крыла однорядное, без добавочных поперечных жилок, лишь между 2.",0
"Плотность, определенная в растворе жидкости Клеричи, составляет 4.25(2), вычисленная 4.25 г/см3.",0
"Кустарник или невысокое дерево с довольно сильно опушенными молодыми побегами; кора ветвей серая; колючки малочисленные или вовсе отсутствуют, тонкие, до 1 см дл.",0
"у основания, ребристые, почти прямые или слегка коленчато изогнутые, простые или от середины ветвистые, с короткими междоузлиями.",0
"Такая потребность называется потребностью в самовыражении, в самореализации, в проявлении своего «я», о чем мы еще будем говорить.",1
Контекст - это понятие эко- логическое.,1
"""Функция в потенциальном аспекте (Фп) - это присущая той или иной единице в языковой системе способность к выполнению определенного назначения и к соответствующему функционированию.",1
В современной психологии мышление «рассматривается как знаковый дериват внешней предметной деятельности» .,1
"Не вполне зрелые семянки желтовато-бурые, расширенная часть их 3-3.5 мм дл.",0
"Стрелки довольно тонкие, голые.",0
"Цвет минерала светло-зеленый, олеск стеклянный, в пленках - матовый.",0
Арангасит обнаружен в пустотах среди кварц-мусковит-турмалин-суль- фидных жил и околожильных грейзенов.,0
"Другая трактовка состоит в том, что сознание объявляется внутренним знанием или убеждением, которое выражается прежде всего в понимании и оценке своих собственных состояний.",1
", в очертании яйцевидные, перистые, с сегментами сидячими или почти сидячими, яйцевидными, до 1.5 см дл.",0
"Нижние стеблевые листья похожи на прикорневые, но мельче.",0
"Столбик 0.5-1.5 мм длиной, цельный или немного расщепленный.",0
Излом ступенчатый.,0
"Спайность совершенная по (001), хорошая по (100) и (010), отдельности не наблюдалось.",0
"«клавитурщик» – технический создатель текста, никак не выражающий своей позиции по обсуждаемым проблемам;",1
"Для агрегатов черта белая, блеск матовый до шелковистого, твердость 1-2.",0
Спиннерета в форме узкого продолговатого конуса длиной 4-5 мкм.,0
"Глазки довольно маленькие, отношение POD : : OOD 0.9; расстояние между задним глазком и задним краем головы 1.2-1.3 OOD.",0
"Дорсоиентральных щетинок 9, преалярных - 4.",0
"Мы уже видели, что для Бахтина взаимосвязи между репликами реального диалога (беседы, дискуссии и т.д.) являются наиболее наглядным и простым видом диалогических отношений.",1
"Боковые глазки соприкасаются с внутренними орбитами глаз, удалены от поперечного киля на расстояние, равное поперечному диаметру глазка.",0
"Представляется уместным введение термина дискурсивная компетенция – составляющая коммуникативной компетенции, которая позволяет измерять уровнь сформированности умений личности в осуществлении эффективной и результативной дискурсивной деятельности.",1
"Семена гладкие, светло-коричневые.",0
"Тело непрозрачное, собственной пигментации не имеет, светло-серого или бледно-желтого оттенка, в зависимости от съеденной пиши.",0
", пластинка его широкояйцевидная, неглубоко выемчатая длиннее ноготка (рис. 1).",0
"базисной функцией является Lz -компонента вектора антиферромагнетизма, равная разности проекции спинов атомов 1 и 2 на ось z.",1
"Исходя из сказанного, функциональное состояние мозга можно определить как звено в системной реакции организма, проявляющееся в виде интегрального динамического комплекса наличных характеристик тех функций и качеств нервных структур, которые прямо или косвенно обусловливают выполнение деятельности""",1
"К. Ф является “членимой”, но “не расчленяемой” единицей;",1
Жизнь небесная - непреходящее бытие души;,1
"Грудь выпуклая, почти равной длины, ширины и высоты, короче брюшка (43 : 52).",0
Взаимодействие между популяциями есть прежде всего изначальное непрерывное взаимоотражение их статических структур.,1
"Естественно, что условия жизни - это, прежде всего, другие люди, поэтому потребность в понимании, в признании непосредственно связана с первой, составляет ее (более или менее) самостоятельную сторону.",1
