text,label
"«Письмо - это не язык, но всего лишь способ фиксации языка с помощью видимых знаков» (из цитаты);",1
ширина 0.9 мм.,0
"""С квантовой точки зрения эффект Капицы-Дирака представляет собой индуци­рованное комптоновское рассеяние.",1
"Притяжения и отталкивания – причины движения и развития, зарождения, роста, существования, жизни, старения, распада и смерти материальных систем.",1
"Иными словами, психология есть на современном этапе теория деятельности.",1
Листочки обертки отсутствуют.,0
4. А).,0
"Общая окраска тела желтоватая с фиолетово-коричневым пигментом вокруг глаз, глазков, усиков, на лбу, по бокам клипеуса, на верхней и нижней губе, верхних и нижних челюстях, щупиках, усиках, ногах, в основаниях нерок, каудального филамента и на последнем сегменте брюшка.",0
"Стеклит с Толбачика прозрачный, бесцветный, в агрегатах белый до сероваго-белого.",0
"Макроскопически давинчиит - минерал тсмно-сирснсвого цвета, в тонких сколах и под микроскопом бледно-сирснсвый.",0
Излом раковистый.,0
", прямой или слег ка извилистый.",0
"«Текст,- пишет он,- это функция времени» (из цитаты);",1
"Солитоны - волны, локализованные за счет нелинейных механизмов, - обычно разделяются на два класса.",1
"По парагенезису и данным природного образования толбачита CuCl2 (Effcnberger, 1988) и эвхло- рина, температурный интервал устойчивости ламмсрита-p составляет 400-650 °С.",0
Наука о целях и целесообразности – телеология.,1
"4-й членик жгутика усиков в 1.9- 2.0 раза превышает его ширину (рис. 2, 4).",0
"Цвет в образцах и зернах под бинокуляром ярко-зеленый до изумрудно-зеленого, но порошок бледно-зеленый.",0
"Прилистники яйцевидно-треугольные, островатые, в нижней части на 1/3 сросшиеся, 3-6 мм длиной, зеленые, позднее буреющие, с нижней стороны опушены простыми белыми волосками с небольшой примесью черных волосков.",0
"Это (навыки XXI века) понятие описывает набор навыков, который обеспечивает согласованность действий и интеграцию различных сфер для достижения успеха в современном мире.",1
"Древесина (вторичная ксилема) рассмотрена на небольших фрагментах поперечной, тангентальной и радиальной ориентации.",0
", ребристые, короткошероховатые или почти голые, немного утолщенные.",0
", 1 см шир.",0
"I, 3).",0
Листья 6-15см дл.,0
"Теория покоя – статика, теория движения – динамика.",1
"Таким образом, результат является неотъемлемым и решающим компонентом системы, инструментом, создающим упорядоченное взаимодействие между всеми другими ее компонентами.",1
"Диалог - это наш символический и корпореальный контакт с объектом вне нас, который мы пытаемся понять, т.е.  к которому мы пытаемся отнести себя.",1
Глаза расположены в два ряда.,0
"Плотность, определенная микрообъемным методом, равна 2.82(2) г/см3, а вычисленная для эмпирической формулы - 2.848 г/см3.",0
"Это - некоторая целостная установка, объединяющая эпизоды умственной жизни индивида.",1
(цитата) .,1
Модус текста – это аккорды модуса в пространстве текста звучащие уже как мелодия;,1
"Соцветие многоцветковое, рыхлое, щитковидное; цветоножки и гипантии с курчавым опушением, уменьшающимся но мере созревания плодов; чашелистики яйцевидно-треугольные или широкотреугольные, при плодах приподнятые или прямостоячие; тычинок 18-20; стилодиев 3-5, свободных; плоды шаровидные, небольшие (0.7-0.8 мм в диам.), черные, суховатые.",0
"Для бактерий возможно определение «ген – участок Д. НК, кодирующий первичную структуру одной полипептидной цепи или одной Н. К, или одной t.",1
", 0.6-1 мм шир.",0
А и З. А имеется замкнутая пятиугольная ячейка.,0
"Бобы сжатые, разделенные на членики, около 15 мм длиной, 4 мм шириной, с",0
"«монолог является в значительной степени искусственной языковой формой» (из цитаты); письменный язык является искусственным, графическим изображением устного; а именно: текст - это целенаправленное речевое произведение, состоящее из неопределенного количества грамматических структур (предложений) и при этом имеющее определенный смысл, в той или иной степени отличный от смысловых показателей этих грамматических структур.",1
"Но быть подверженным коммуникации - это не то же, что быть повременным ею;",1
"Мерикарпии эллиптические или яйцевидные, 5.2 мм дл.",0
"Мотивировка наименования, тот признак, который делается представителем понятия для сознания,-это несомненная С. Д;",1
"Сред неси инка с парапсидальными бороздами, достигающими Уг ее длины, с грубоячеистой скульптурой.",0
"Прикорневые листья на длинных тонких черешках, с треугольной в очертании, трижды тройчатой пластинкой 3-7 см дл.",0
К.Ф - это целостный отрезок речи;,1
"Коммуникацию как (само) раскрытие понимания, можно рассматривать как процесс своеобразной навигации.",1
"Головогрудь овальная, спереди тупо",0
"Уникальность языковой личности конкретного индивидуума есть не что иное, как неповторимость комбинации социально- психологических характеристик ее речевого поведения.",1
"Межсосудистая поровость точечная очередная, окаймленные поры расположены свободно.",0
Грудь.,0
Губы низкие.,0
"«Труд,- писал Маркс,- есть прежде всего процесс, совершающийся между человеком и природой, процесс, в котором человек своей собственной деятельностью опосредствует, регулирует и контролирует обмен веществ между собой и природой» (цитата);",1
"Марксистская психология рассматривает сознание как функцию мозга, представляющую собой специфически человеческое отражение бытия.",1
Вычисленная плотность равна 3.56 г/см3.,0
"""любое функциональное состояние является результатом включения мозга в конкретную деятельность, в ходе которой оно активно преобразуется, обусловливая успешность реализации этой деятельности.",1
malawi и Ph.,0
"Ферроиндиалит хрупкий, с раковистым изломом.",0
"В случае разреженных сред под пондеромоторными силами часто понимаются усредненные повремени силы, действующие на отдельный электрон в пространственно-неоднородном электромагнитном поле.",1
Конкретное языковое сознание представляет собой социально детерминированное явление.,1
", 0.5-1 мм шир.",0
"Отдельные кристаллики канонеровита (из сростков) бесцветные, моноклинной сингонии, с внешней симметрией 2/т, с габитусными гранями 7, 6,е и малоразвитыми и не всегда проявленными (по результатам гониометрических измерений с применением столика Федорова; табл.",0
Створки выпуклые с плоской центральной частью лицевой поверхности.,0
"Третий членик в 1.3-1.6 раза длиннее 4-го, равен 0.8-1.0 длины 6-го членика, 1.0-1.3 длины шпица, с 3-12, в норме с 4-8, вторичными ринариями в базальной части (рис. 1 б).",0
В заднем крыле начало /Ссектора сильно сдвигается по поперечной жилке в сторону М. Р-1.,0
"Купол почти округлый, с коротким пиком, одна сторона его поверхности с ретикулом из угловатых ячей; каждая ячея окаймляет одну крупную пору.",0
Цвет при жизни.,0
Агрегаты состоят из очень мелких удлиненных пластинчатых кристаллов объединенных в параллельные или расходящиеся пучки (рис. 2).,0
"Перфорационные пластинки простые (обр. 260, табл.",0
"«Сознание,-писал Маркс,-с самого начала есть общественный продукт и остается им, пока вообще существуют люди» (цитата);",1
Смысл жизни - это психологический способ переживания жизни в процессе ее осуществления.,1
"сумму структурных отношений, нашедших лингвистическое выражение» (из цитаты);",1
Пыльники с ресничками на верхушке.,0
"Это - учение об одной из сторон одного из видов или аспектов деятельности - именно речевой деятельности""",1
"Темно-коричневая, переднеспинка латерально с 2 щетинками.",0
"Блеск минерала стеклянный, черта белая.",0
"Тело светло-зеленое, сочленения усиков светло-коричневые, глаза красные.",0
"Семя в зрелом плоде отстает от перикарда, на брюшной стороне почти плоское.",0
Затылок со сглаженной ячеистостью.,0
"Епифановит оптически двуосный, отрицательный.",0
"Голова заметно шире груди (53 : 43), значительно шире брюшка (53 : 40), поперечная.",0
"Это одновременно и единица бытия, объединяющая в себе объективно-социальное и субъективное, психологическое начало, обладающая своеобразной внутренней структурой и орга­низацией.",1
"Таким представлением и является «деятельностное» представление глобальной речи, трактовка ее как определенного вида деятельности, а именно как речевой деятельности.",1
"Пронотум темно-бурый, без пятен, передние утл ы осветлены.",0
Листья 4-6 см дл.,0
"Лепестки белые, 1.3-1.5 мм дл.",0
"Ноги, исключая черные тазики, желтые.",0
Красч = 50°.,0
"Последней особенностью психического отражения, на которую мы считаем важным обратить внимание, является то, что, осуществляя интеграцию и ориентацию субъекта во внешнем мире для освоения последнего, в качестве своего обязательного звена психика предполагает также освоение и учет внутреннего мира субъекта – объективной реальности его организма и тела.",1
"Интроны – участки Д. НК, копии которых удаляются из первичного транскрипта и отсут­ ствуют в зрелой Р. НК.",1
каждое подобное движение - это коммуникативное событие;,1
", заглубленный.",0
Твердость по шкале Мооса 2 уг.,0
На щитке 9 щетинок.,0
"Черешки у листьев длинные, 3.5-8 см дл.",0
", 2-3 (3.3) мм шир.",0
"индивидуальность и целостность - достояние популяции, а не организма.",1
"Урамарсит образует несовершенные пластинчатые кристаллиты до 2 мм и пленочные образования, реже встречается в форме уплощенных квадратных кристаллов размеров до 0.1 мм с основными формами (001), реже (010).",0
Кустарник до 1.5 метров высотой.,0
ЫЧ = 55°.,0
Плечевой бугорок с волосками.,0
Длина тела 6.0-8.8 мм.,0
"Модель модифицированной гравитации стоит рассматривать как альтернативу О. ТО; заряд, являющийся эффективным проявлением дополнительных измерений.",1
Спайность не наблю дается.,0
"Средние и верхние стеблевые листья на продолговато-ланцетном, белопленчато-окаймлеином влагалище 1-1.5 см дл.",0
"Ключевой характеристикой шума является спектральная плотность W(f), характеризующая распределение мощности случайного сигнала по частотному спектру f .",1
"Окончание этого отростка служит источником плазменных «пуль», представляющих собой светящиеся следы распространения волн ионизации, скорость движения которых составляет примерно 200 км/с . Именно она называется апокампом.",1
"Форма пор разнообразна за счет инкрустации породой (обр. 260, табл.",0
"Терминус хвоста гладкий, без кутикуляций колец.",0
Конечные сегменты почти до основания пальчато рассечены.,0
"Эти непонятийные С. Д, входящие в лексический фон, мы будем теперь называть по их принадлежности - фоновыми С. Д. Речь идет только о степени присутствия некоторого качества: минимум сведений, например, о дереве, по Потебне, - это ближайшее значение, максимум (в ботаническом описании) - дальнейшее.",1
Голень с 195-198 сенсиллами.,0
"II, 2).",0
", сверху голые, снизу слегка опушенные, но краю усеянные железками и единичными волосками; листочки в числе 5-7 удлиненно-эллиптические, мелкие 14-25 мм дл.",0
"boldyrevi, но отличаются некоторыми перечисленными ниже признаками.",0
Смысл жизни как стремление с наибольшей полнотой реализовать себя в жизни;,1
"Отсюда вытекает, что в каждом случае преобразования Фп-Фр есть элемент развития (как известно, идея развития в толковании понятий возможности и действительности была вы- сказана уже Аристотелем).",1
"Диалог - это наше вовлечение, «ввержение» в коммуникацию;",1
"Причина такого странного положения - собственное время сравниваемых популяций, т.е.  дления.",1
"На средне-, заднегруди, 2-5-м брюшных тергитах имеются мелкие полусферические краевые бугорки.",0
"Воплощение смысла в значениях – это глубоко интимный, психологически содержательный, отнюдь не автоматически и одномоментально происходящий процесс.",1
"Кромка узкая, ниже купола дистальный конец кромки образует плечо.",0
Альтернативный сплайсинг – образование нескольких разных зрелых Р. НК из одинаковых пре­Р. НК за счет исключения некоторых экзонов и/или оставления частей интронов.,1
"Цитик поперечный (10 : 28), его ячейки более мелкие чем на среднеспинке, Заднеспинка в виде небольшой пластинки, в глубоких ячейках.",0
2. ЕИ.,0
"Для эукариот ген можно определить как участок Д. НК, по которому образуется функциональная молекула Н. К. Поскольку в ряде случаев интроны (или их части) оказывались «кодирующими», а экзоны «некодирующими», то правильнее называть экзонами те участки Д. НК, копии которых составляют зрелую Р. НК, а интронами те внутренние районы гена, копии которых удаляются из первичного транскрипта и отсутствуют в зрелой Р. НК.",1
"Почки мономорфные, 4.5-9 мм длиной, яйцевидные или округло-яйцевидные, со слегка уплощенным отогнутым носиком, со стороны побега немного уплощенные, по бокам килеватые, темно- или красновато-коричневые, шерстисто-опушенные или почти голые.",0
", 3-5 мм шир.",0
Шпиц в 3.6-4.6 раза длиннее основания 6-го членика.,0
В одной из распространенных трактовок сознания оно определяется как совместное знание (Joint or Mutual Knowledge).,1
Критерием развития личности служит наличие или отсутствие смысла жизни.,1
"Сплавы этой серии представляют собой новое четвертое поколение супермагнитов, широко используемых в технологиях прецизионных навигационных приборов и устройствах спинтроники""",1
"На электромагнитных сепараторах минерал отделяется в магнитную фракцию при средне-сильном токе, но простыми магнитами не притягивается.",0
"Примем, что изменчивость есть свойство любой исследуемой совокупности однородных сущностей (в частности биологических объектов), описывающее их разнообразие как объективное явление.",1
"Волокнистые трахеиды со средней толщиной стенок 3.2-3.4 мкм, несущие поры со слабо заметным или неразличимым окаймлением (обр. 260, табл.",0
где q - это приливный заряд.,1
"Ноги длинные со слабо головчатыми волосками, на 1-м членике лапок 5, 5, 5 волосков.",0
", а особую разновидность языкового творческого акта, имеющую свои параметры, отличные от параметров устной речи.",1
Нижняя губа продольная серо-желтая с тонкой белой полоской на вершине.,0
"Длина передних крыльев в 2.5 раза больше их ширины, Стигмальная жилка в 4.3 раза больше маргинальной и в 1.4 раза меньше постмаргинальной жилки.",0
"Канонеровнт образует тонкую белоснежную корочку на гранях кристаллов кварца, топаза и касситерита; эта корочка состоит из мелких радиально-пластинчатых агрегатов с величиной кристалликов от долей миллиметра до 1-1.2 мм, чрезвычайно хрупких и разрушающихся под иглой.",0
"и по этой причине другое часто используемое название (особенно в физике плазмы) - это «сила Гапонова-Миллера».  где  - векторный потенциал поля, E:o(r) и w - амплитуда его напряженности и частота, горизонтальная черта обозначает усреднение по периоду поля.",1
"Продорсум (рис. 1, 2).",0
