text,label
Мейоз особый тип клеточного деле- ния образуются клетки содержащие гаплоидный,1
самом деле если внешняя Там 317 этот пере-рождения должен назван вербальным мышлением преобладающей спонтанная представляющая симультанное разворачивание рече-мысли современной психофизиологии связей языковыми уровней образуется ходе биографии влияет воплощения слове получила вербальной сети Повторяющиеся ситуации членов обслуживаются типическими формами носят жанров Дискурсивная дискурсивное самовыражения каждый коммуникативный всей типичности столь уникальное сколь неповторим облик,1
модусе назвали сложными модусными перспективами три минимум сложные сложные сам модус Сложные логические эмоциональные выразительные линии которым отдельного распространяются определенные смыслы определенные дистанции меняются высказанные особенности текстообразующих ролей создание автором сложных модусных Они линиями сложных модусных перспектив предполагает моментов реальный мир человек являющийся известных психофизиологических особенностей обусловливающих человеческие познания наконец общезначимых форм внешнего идеальных явлений представлением деятельностное глобальной материального телесного существа обладающего определенной физической организацией мозгом формируется рода физиологических предпосылок социальных возникает общественной практики значит фактом объективной независимым Единичный Структурность целенаправленность вот важнейшие всякой трудовая простая трудовых беспорядочное проявление точно речевая актов брошенных входящих какую-то целиком теоретическую интеллектуальную частично практическую изолированных актов лингвистики речевая варианте представлен психологической концепцией школы Л. С. Выгодского ни коей психофизиологических процессах происходящих индивиде отражении индивиде активном общественного миру производительной детерминации Такое хорошо выражено Э. В. Ильенковым подчеркивающим необходимость мышление созидающую науку технику реальный продуктивный выражающий движении слов изменении Психология со содержания субъектам Иными словами психология современном этапе такое лингвистика ? одного аспектов,1
Плеохроизм Угол угасания 4-5° относительно удлинения кписталла 1т е.,0
Каплин Описание 3.5 черный черными Голова Глазной мостик 2-рядный Щупики 1-й слабым сенсорным полем 3-й длинный Лицо клипеус Усики монохромные 4-й 1.9- 2.0 Грудь Плечевой бугорок Скутум крепких дорзальных акростихальных щетинках Жужжальца Крыло макротрихиями жилках c макротрихиями X безмакротрихий Гипопигий наружному гипопигий крепких щетинках внутреннему вентральному Гонококситы группами стоящих Гоностиль 1.8 раз крупный широко усеченной вытянутой конечному зубцу вершиной окруженный группой зубчиков над конечным Тегмен прямоугольной склеротизо- ванными отростками,0
0.9 Головогрудь овальная спереди,0
65-73 Адоральные ог 32-41 листовидные силь- редин но-проксимальной ог2 61-49 листовидные ог2 41-49 щетинковидные Пальпы 139-143 четырехчлени- ковые формула 0-1-3-10 +1ш Хелицеры 303-315 chb 77-86 cha 8-12 шиловидные Эпимеральная 6-8 Эпимеральная формула 3-1-3-4 lb 2а J6 4а 4.,0
Аксенов Мсндигит встречен несовершенных длиннопризматических уплощенных размерами Х0.2.,0
Гамянин Звягинит полупрозрачный прозрачного жемчужно-белый кремовый желтовато-коричневатый бледно-розовый сиренево-розовый перламутровый н плоскостях изломе жирный Мооса 2.,0
темно-коричневый коричневая сильный направлении 3.56,0
1984 было замечено ламмерит-Р встречается крайне Обломки самых ранних пробах отбора первые лет после окончания извержения наблюдался отдельных зерен размер варьировал 0.01 0.15 Выделения большей осколочный вид уплощены облик призматический вдоль удлинения характерна частая штриховка бутылочно-зеленый бледного темного механической примеси минерале присутствует тонкодисперсный гематит образующий буроватые сгущения зональные контуру зерен зерна прозрачны Ламмерит-Р тесной ассоциации эвхлорином NaKCu30 S пийпитом K4Cu4 S04 • McCl алюмоключсвскитом K3Cu3 Al Fc 02 S04 аларситом A1As04 ламмеритом Cu3 As Р 04 парагенезису данным природного образования толбачита CuCl2 Effcnberger 1988 эвхло- рина температурный интервал устойчивости ламмсрита-p 400-650 °С,0
Марченко три состоящие тесно сближенных микротрубочек Лента л.,0
асимметричные шипом Стоматоцисты неизвестны,0
СОдействия получение фокусированного полезного результата неотъемлемым решающим компонентом инструментом создающим упорядоченное всеми компонентами сам полезный несомненно функциональным феноменом назвали всю архитектуру функциональной системой Ниже будет дана подробная аргументация понятия управляющая полноценной системой несмотря управляемый находится вне теоретиков полезности экономист Bross 1953 определяет пользы Суд последней инстанции блестящий словесный аргумент солидно звучащий абстрактный ясная логика математика реальном Наконец целого судом последней инстанции функциональной органическую оказывающую решающее влияние ход формирования последующие реорганизации Генетика физиология наследственности Бэтсон 1906 Цит Гайсинович 1988 Примем любой исследуемой однородных сущностей биологических объектов описывающее разнообразие объективное первом приближении предположить наблюдаемая комбинаторики разнообразия предшествующего низкого предыдущего уровня Классический разнообразие химических комбинаторики элементарных воплощенных Периодической Д.И Менделеева Мутация наследуемое генетического материала сводимое характеристикам генетического материала генотипа родителей Хромосомные мутации тоже преимущественно рекомбинационные Мутация нетождественной репарации Строго говоря геномные мутации модификационные ненаследуемые менее влекут наследственные Пространственную организацию ядра рассматривают эпигенетической отметить прионизация амилоидных агрегатов вовсе обязательно патологический Прионы наследственные факторы низших млекопитающих Наконец прионизация наследственной низших модификаций млекопитающих Биологическая химическая физическая подчиняется законам химии физики знаний состоящая научных законов теорий Биология биологических системах изучает преимущественно характерные специфические признаки свойства отличающие живые неживых целях целесообразности Целесообразность закономерность аналогичный сводящийся следствия конечная причины целесообразность соответствие цели обращенный рамках аксиоматики целесообразное самодвижение самопокой Дарвинизм происхождения естественным отбором основных теорий телеологии естественного отбора борьбе наследственности генетики Притяжения отталкивания причины зарождения роста старения распада смерти материальных Законы телеологии требования предъявляемые сумме отдельным слагаемым Основная Воспроизведение дискретный деления жи- вой целесообразности категориальным основанием биологии Случайность беспричинность дарвинизм происхождения естественным отбором прогрессивного природы Теорией стабильности генетика Т.о.  биология любая дефиниций законов состояния покоя сохранения основанных понятиях законах логических качественных математических количественных теориях покоя статика динамика Целесообразность первопринцип биологии представляется синтезом случайности случайной причинностью причинной случайностью особой закономерности отнятой отжатой жизнью живыми системами случайности дополнительная закономерность случайность беспричинность общая относительности О. ТО являясь общепризнанной теорией Модель модифицированной стоит альтернативу О. ТО заряд являющийся эффективным проявлением дополнительных измерений Само расширение выглядит добавление метрическую функцию следующего члена разложения 1/r благодаря чему каждая точка края тени становится уникальной пробой потенциала Ч. Д a J/M угловое ускорение Ч. Д M масса J угловой момент q приливный заряд Далее необходимо отметить метрики Шварцшильда Рейснера Нордстрома Керра Ньюмана точными решениями расширенной C1 удвоенную Массу Ч. Д C2 какой-либо зарядов Примером наблюдений возможно обнаружить сильное гравитационное линзирование r0 радиус фотонной орбиты θi наклона вращения Ч. Д лучу размером тени диаметр вдоль вращения точкой обзора наклонения физике сплошных сред пондеромоторные силы усредненные си­лы действующие обусловленные неоднородностью неоднородностью таковой разреженных сред пондеромоторными силами усредненные повремени силы действующие электрон пространственно-неоднородном электромагнитном поле нерелятивистском приближении пондеромоторная действующая электрон оказывается направленной вдоль градиента средней интенсивности градиентной силой причине другое используемое особенно физике плазмы Гапонова-Миллера векторный потенциал E o r w амплитуда напряженности горизонтальная черта обозначает усреднение периоду напряженности электрического магнитного полей р импульс v скорость энергия At коэффициенты разложения являющиеся произвольными функциями трехмерного волнового .c clkl соответствующая волновому вектору k.,1
А двуветвистые обе соединены предыдущими заднем крыле начало /Ссектора сдвигается жилке сторону М. Р-1 линии Банкса развиты парах стигмы белесые темном фоне Самцы аксиллярные,0
А простая разветвленная ветви заднем крыле 2.,0
