text,label
"""Развитие антропоцентрической лингвистикиназывают дискурсивным переворотом в гуманитарных науках; текст – наблюдаемая лингвистическая данность и моделируемый объект – является не только основным, связующим звеном между коммуникантами в процессе их взаимодействия, но и объектом, сущностная природа которого в значительной степени предопределена его функцией (из цитаты А.Е.Кибрика);",1
Дискурс – это речь «погруженная в жизнь».,1
"То, что мы называем внутренними переживаниями, суть явления, возникающие на поверхности системы сознания, в форме которых сознание выступает для субъекта в своей непосредственности.",1
"Повторяющиеся ситуации взаимодействия членов общества обслуживаются типическими формами речевой коммуникации, которые носят название жанров общения.",1
"Перед клоакой, с 1зентрал ной стороны кольца кутикулы расширены, чис.",0
"Показатели преломления, измеренные в иммерсионных жидкостях (X = 589 нм): Np = 1.626(5), Nm = 1.714(3), Ng= 1.740(5).",0
его базального диаметра.,0
"Стебли приподнимающиеся или распростертые, в нижней части слабо опушены короткими, простыми, прижатыми, белыми волосками, в молодом возрасте очень часто с примесью черных волосков (рис. 1).",0
Лента л1 идет внутри левой складки бороздки (рис. 3 В: 4.,0
Эта лента проходит в стенке правой складки бороздки (рис. 3.,0
"Максиллы серо-желтые, продольные, шагренированы как хелицеры, с беловатой вершиной.",0
"Поры овальные, овально-вытянутые, довольно крупные, с длинной осью, перпендикулярной к оси членика сосуда, их размер 2.8-3.0 X 1.4 мкм; апертуры включенные, округлые и горизонтально-вытянутые, размером 0.8-1.0 и 0.8-1.2 мкм.",0
Понятие «социально-эмоциональная компетентность» чаще всего встречается в контексте образовательного процесса.,1
", при основании железистые.",0
"Анальные щетинки (69-82) слабо утолщенные, опушенные.",0
"Итак, текст - это продукт письменного варианта языка.",1
"Многочисленные, регулярно расположенные поперечные штрихи отходят билатерально от передних субмаргинальных ребер.",0
", 8-10-цветковые.",0
"От кинетосом отходят три ленты, состоящие из тесно сближенных микротрубочек.",0
Воспроизведение – дискретный процесс деления жи- вой системы на несколько частей;,1
"понятие смысла жизни, или жизненной концепции, которое в известной мере характеризует теоретический способ организации личностью жизни.",1
", толстоватые, отклоненные.",0
"лучи в числе 6-17, слегка неравные, до 2-3.5 см дл.",0
Задние глаза расставлены (расстояние между глазами больше диаметра глаз).,0
Цвет на препарате.,0
"Т.о.  , теоретическая биология – теоретическая телеология или просто телеология, как любая наука или учение, состоит из понятий (их дефиниций), законов состояния - покоя (сохранения) или движения (изменения), и основанных на понятиях и законах логических (качественных) и математических (количественных) теориях.",1
"Созна­ние и личность рассматриваются как продукты и как “мо­менты”, стороны деятельности.",1
"""Известно , что какая-либо фигура или группа точек называется киральной, т.е.  обладающей киральностью, если ее изображение в идеальном плоском зеркале не может быть с ней совмещено.",1
"Г.Г.Филиппова использует термин «интеллектуальная форма регуляции деятельности», функция этой формы регуляции – «изменение поведения субъекта в соответствии с ситуативными, неповторяющимися изменениями объекта».",1
и 5-10 мм шир.,0
", 8-14 мм шир.",0
Средние и задние голени светлые с бурыми продольными полосами и бурыми вершинами.,0
"Согласно , вынужденное комптоновское рассеяние электронов на стоячей волне интерпретируется как дифракция де-бройлевской волны электрона на периодической структуре с периодом - длина волны поля излучения), образованной плоскостями разных фаз (пучностей) стоячей волны.",1
Длина (мм).,0
(цитата);,1
"Аданальные щетинки adx (164-168) заметно расширены и срединной части, опушенные; ad2 (114-131), ad2 (98-110) и adA (98-110) слабо расширенные и менее опу шенные.",0
"А и З. А коротко двуветвистые, обе соединены с предыдущими короткими жилками.",0
одуванчик (мотивирующая С. Д производна от дуть) называется еще пухлянкой (мотивирующая С. Д производна от пухлый);,1
"Модели с двумя дублетами хиггсовских полей, являющиеся расширением С. М, рассмотрены в .",1
"Точно так же столяр - это«рабочий, занимающийся обработкой дерева и пилением изделий из него», т.е.  любых деревянных изделий, а не только «столов».",1
"Двух-трехрядные лучи могут быть без однорядных окончаний или с короткими, однорядными окончаниями из 2-6 клеток, расположенных чаще с одной стороны луча.",0
"Иногда стеклит формирует, как правило, вместе с эвхлорином, алюмоключевскитом, лаш бейнитом и гематитом, тонкие корочки площадью до 1.5x2.5 см на поверхности вулканического шлака (рис. 1, б).",0
мкм шириной.,0
"Бобы на ножке, равной или чуть длиннее чашечки, поникающие, неравнобокие продолговатые, часто несколько изогнутые, 7-13 мм дл.",0
"Трубка венчика 1.2 см длиной, в верхней части расширенная, изогнутая, довольно сильно выставляется из чашечки, верхняя губа 2.5-3 мм длиной, почти до основания рассеченная на широко-обратнояйцевидные доли, нижняя губа 5-6 мм длиной, с полукруглыми 1-1.5 мм длиной и 2.0-2.5 мм длиной, и почковидной, по краям мелкозубчатой, на верхушке слегка выемчатой долей средней губы 3.5-4 мм длиной, 5-6 мм шириной, с бородкой волосков.",0
Стернум сердцевидный желтый.,0
"Цветки розовые, розоватые, желтоватые.",0
"Анализируя эту точку зрения, Б. Ф. Ломов отмечал: ""По нашему мнению, противопоставление социального и интериндивидуального неправомерно, отношение между ними - это отношение явления и сущности, единичного и общего.",1
"Корневище короткое, стебли плотно скучены.",0
Длина тела 1.74 мм.,0
"И в самом деле, если «внешняя речь есть превращение мысли в слова»  Именно этот процесс пере-рождения мысли и должен быть назван вербальным мышлением.",1
Жужжальца черные.,0
"Следовательно, психику необходимо понимать, во- первых, как отражение субъектов самого себя и внешнего мира, а во-вторых, как процесс интеграции этих отражений в системе единого образа, вызревающего в процессе поведения (деятельности) субъекта и необходимого для его регулирования.",1
"Анализ конкретных высказываний, опирающийся на понятие К. С, представляет собой один из возможных способов изучения Фр. Значение формы - это ее системно значимое внутреннее свойство.",1
"Биология – наука о живых (биологических) системах, изучает преимущественно характерные или специфические признаки, свойства живых систем, отличающие живые системы от неживых.",1
Структурность и целенаправленность - вот две важнейшие характеристики всякой специфически человеческой деятельности.,1
"Большинство щетинок простые, некоторые наружные (на ногах I, П), внутренние (на ногах 111, IV) и дорсальные - широкие, вогнуто-листовидные, округлые дистально и трубчатые у основания.",0
"Листочки нижних листьев продолговато-овальные, островатые, ярко-зеленые; листочки средних листьев ланцетные, островатые, сизоватые от более или менее густого опушения; листочки верхних листьев ланцетно-линейные, длинно заостренные, на конце немного мозолистые.",0
Скутум в длинных крепких дорзальных и более мелких акростихальных щетинках.,0
"Такое понимание позволяет рассматривать определенную группу носителей языка, имеющую сходные речеповеденческие проявления, как «коллективную языковую личность».",1
Черта белая.,0
Цвет порошка минерала (черта) светло-зеленый.,0
Не растворим в воде и не флуоресцирует.,0
Эти 22 пространственные группы являются киральными группами.,1
"Здесь t - время, mp - масса атома, z - вертикальная координата, g - ускорение свободного падения.",1
"Если угол между направлением импульса падающего электрона Ро и волновым вектором k (о - угол скольжения падающего электрона), то условие Вульфа-Брэгга имеет вид вероятности кластера.",1
"При этом популяция хищника (жертвы) есть не только причина структуры популяции жертвы (хищника), но и следствие.  популяция выступает и как причина и как следствие.  совокупный вещественно-энергетический субстрат организмов популяции остается всего лишь носителем приспособленности.",1
"I, /, 2) или с короткими клювиками, расположенными чаще с одного конца членика.",0
Размер индивидуальных микрокристаллов до 1 мкм в поперечнике и до 100-200 мкм по удлинению (рис. 3).,0
Она рассматривает общение на уровне индивидуального бытия человека» (цитата);,1
"В нерелятивистском приближении пондеромоторная сила, действующая на отдельный электрон, оказывается направленной вдоль градиента средней интенсивности поля и поэтому часто называется градиентной силой.",1
"ЗМ = 40-45°, 2.",0
В этом смысле неживая природа доля классической физики - аддитивное целое.,1
Под размером тени будем понимать ее диаметр вдоль оси вращения.,1
"Брюшко продолговатое (52 : 40), с выступающим яйцекладом.",0
В какой-то мере коммуникация как диалог - это постоянная задача;,1
"Цветки одиночные или в соцветиях по 2-3; цветоножки тонкие, железисто-щетинистые, 10-20 мм дл.",0
"Древесина рассеяннососудистая, просветы сосудов в поперечном сечении округлые и овальные, расположены главным образом одиночно, реже парами, группами по 3-4, рыхлыми радиальными и косотангентальными цепочками по 3-5, нередко меняющими правильную ориентацию под давлением породы при фоссилизации (обр. 261, табл.",0
Хрупкий.,0
"где Δμ - разность химических потенциалов свободного мономера в растворе и мономера в составе кластера, σ - поверхностное натяжение, r0 - радиус мономера.",1
Поскольку стоячая волна есть суперпозиция двух встречных бегуших волн одинаковой частоты; rдe k - волновой вектор одной из бегуших волн.,1
"Это и короткая (однословная) реплика бытового разговора, и большой роман или научный трактат.",1
возникает...,1
"К. Ф следует признать первичной, непосредственно заданной в языковом сознании говорящих единицей языковой деятельности;",1
"Язык предстает как иерархия единиц различных порядков; целое, которое мы называем нашим “знанием” языка; которое можно определить как неустойчивую, или динамическую заданность; языковой материал, с одной стороны, существует для говорящего в конкретном и непосредственном виде, как собрание готовых языковых “предметов”;",1
Но «слово»...,1
Сам принцип детерминизма может быть рассмотрен как форма редукции неопределенности.,1
", нами рассматриваются те же средства, что и в модусе высказывания.",1
"II, /, 3, 4).",0
"Если из семемы вычесть понятийные С. Д, то в остатке окажется совокупность непонятийных С. Д. Эту совокупность мы именуем лексическим фоном.",1
"члениками в количестве 2-4, линзовидными, сетчато-морщинистыми, коротко-опушенными и рассеянно коротко-шиповатыми.",0
"Дорзальное субмаргиналыюе ребро хорошо развито и пересекается штрихами, между штрихами и в нижнем вентральном углу чешуйки располагаются поры.",0
"Церки 12-13-члениковые, каждый членик, кроме 1-2 вершинных несет с внутренней стороны 1-3 боковых опорных шипа.",0
", без клювиков (обр. 260, табл.",0
"факторами; текст, взятый в событийном аспекте; речь, рассматриваемая как целенаправленное социальное действие, как компонент, участвующий во взаимоотношении людей и механизмах их сознания (когнитивных процессах).",1
"Это наука об активном отношении общественного человека к миру во всех формах этого отношения - как непосредственно производительной, так и теоретической, и во всех формах детерминации этого отношения.",1
Эндосперм плоский (рис. 2).,0
"Тело удлиненно-овальное, 2.24-3.20.",0
", 3-4 (5)-лучевые; лучи 2-4 см дл.",0
", крупнозубчатыми.",0
"Это и не связи отдельных его """"единиц"""", а внутреннее движение его образующих, включенное в общее движение деятельности, осуществляющей реальную жизнь индивида в обществе.",1
"Плоды широко-обратиояйцевидные, плосковынуклые или двояковыпуклые, редко слабо-трехгранные, 1.7-2.0 мм дл.",0
"Верхняя губа, мандибулы и базальные членики щупиков золотистые, Второй и третий членики обеих пар щупиков темно-бурые.",0
Излом ступенчатый.,0
слабо опушенные: а (65-73) гладкие.,0
"«принцип системности, прошедший естественный отбор временем, радикальным изменением идеологического контекста и сменой ключевых фигур нашей психологической науки, может быть сформулирован в виде необходимости в психологии многоуровневых объяснений, объединяющих разные уровни причинности.",1
"Прозрачный, со стеклянным блеском.",0
В других концепциях сознание рассматривается как соотнесение индивидом своего субъективного опыта с социально-выработанными образцами.,1
"Наука – система знаний, состоящая из научных понятий, законов и теорий.",1
"""понятие генома в отличие от генотипа является генетической характеристикой вида в целом, а не отдельной особи.",1
"Цвет минерала темно-коричневый, черта коричневая, блеск сильный стеклянный.",0
"Имеется 10 пар генитальных, 2 пары анальных и 4 пары аданальных щетинок.",0
Опушение груди и брюшка светлое.,0
Длина задней узкой цилиндрической части хвоста составляет 70-74% общей длины хвоста.,0
Стилодни около 0.5 мм дл.,0
"С одной стороны, смысл жизни выражает притязания личности, ее стремления, потребности, с другой (и это очень важно) - является подтверждением ее реальных достижений, реальной способности выразить себя в формах жизни.",1
"Анальная лопасть развита, округлая.",0
Аксиальная паренхима представлена достаточно обильной апотрахеальной - диффузной и скудной паратрахеальной-вазицентрической типами.,0
"Говорилось, что „сознание"" есть термин очень сбивчивый»; оно понимается главным образом как феномен сугубо индивидуальный, связанный с накоплением, трансформацией и организацией опыта индивида, или как проявление духовной связи между людьми.",1
"Ими создается то, что называют генетическим единством органического мира во времени.",1
Черта белая.,0
Передние голени бурые с тонким светлым кольцом в базальной трети.,0
Зубцы чашечки отсутствуют.,0
"Глаза в густом темном опушении, сближены на значительном протяжении.",0
"Вблизи субмаргинального ребра ретикулум отсутствует, и поверхность щита выглядит гладкой.",0
Зонтики 3-8 см в диам.,0
"Листья сверху темно-зеленые, рассеянноопушенные, снизу более светлые, с курчавым опушением, с черешками в 1.5-2 раза более короткими, чем пластинки; листовые пластинки цветущих побегов широкояйцевидные или широкоэллиптические, 3-6 см дл.",0
Листовые пластинки стерильных побегов более крупные и широкие (до 6 см дл.,0
"Мендигит оптически двуосный отрицательный, пт= 1.782(5), ng = = 1.796(5);",0
"Условия коммуникации, точнее - сама коммуникация является напряженным, тенсиональным процессом.",1
