text,label
"Уфимов Растения многолетние поликарпические вертикальным корневищем каудексом цельным ветвистым Стебли нескольких покрытые пленчатыми остатками 4-17 коленчато изогнутые ветвистые междоузлиями прикорневые ланцетными влагалищами очертании перистые сегментами сидячими сидячими яйцевидными крупнозубчатыми Зонтики 6-17 2-3.5 травянистые узколинейные Зонтички 11-15-цветковые оберточки сходные листочками зонтичка 2-5 Зубцы ланцетные равные Лепестки белые 1.3-1.5 обратнояйцевидные цельные ноготка загнутой внутрь одиночным секреторным канальцем долго сохраняющиеся Подстолбия короткоконические стилодии 0.5-0.7 толстоватые отклоненные Плоды боков карпофор двураздельный комиссура Мерикарпии эллиптические 5.2 спинки волнистые короткокрыловидные килевидные неразвитые Экзокарп Мезокарп паренхимных частично разрушающихся Секреторные 1-4 ложбинках комиссуральной реберные секреторные Экзокарп семенная кожура Семя зрелом плоде отстает перикарда брюшной плоское Пименов Растение 10-25 многоглавым 6-15см 5-10 линейно-обратноланцетные крупными лопастные оттянутые длинный бескрылый бледно-зеленый черешок оетроватые Стрелки 11-13 узкие зеленые наружные яйцевидных яйцевидно-ланцетных прилегающие внутренним широкобеловатые перепончатые рожков внутренние рожков отчасти рожками Цветки пыльцой вполне зрелые семянки желтовато-бурые расширенная 3-3.5 мелко шиповатые пирамидка 0.6 переходящая носик Мулдашев Растение 60-80 выс Стебель тупотрехгранный внизу остротехгранный переходит трехгранный прицветный лист соцветия стебель бледно-зеленые охристо-окрашенные чешуевидные верхний трехгранной внизу плоской вверху 10-12 Корневище короткое стебли скучены Соцветие зонтиковидное веточками Колоски веточках могут сдвоены удлиненно-яйцевидные 1-2.7 Кроющие светлоокрашенные палевые присутствует красно-бурый сохраняется красно-бурых штрихов выступающая светлая выходящая узкого неглубокого выреза ости Ость шипиками пленчатая верхушка ресничек узкояйцевидные 3.5 X 1.7 Пыльники Рылец Плоды широко-обратиояйцевидные плосковынуклые двояковыпуклые слабо-трехгранные 1.7-2.0 1.2-1.6 остатком столбика 0.25 черновато- зеленовато-бурые слабо-блестящие матовые расширенными бахромчатыми околоцветными Панченков Описание Древесина вторичная ксилема рассмотрена небольших фрагментах тангентальной радиальной ориентации Древесина рассеяннососудистая просветы главным образом одиночно парами группами рыхлыми радиальными косотангентальными цепочками меняющими правильную ориентацию давлением породы фоссилизации 261 II тонкостенные оболочек 1.8-2.5 100-190 15-18 клювиков I клювиками расположенными одного Перфорационные I размещены прямых скошенных боковых стенках Межсосудистая поровость точечная очередная окаймленные свободно овально-вытянутые длинной осью перпендикулярной сосуда размер 2.8-3.0 X 1.4 апертуры включенные горизонтально-вытянутые 0.8-1.0 0.8-1.2 Встречаются угловатые квадратные округлыми углами заостренно-вытянутые Форма разнообразна счет инкрустации породой I Волокнистые трахеиды стенок 3.2-3.4 несущие заметным неразличимым окаймлением 1,1 Имеющийся материал позволяет определить наличие сосудистых вазицентрических трахеид Аксиальная паренхима представлена достаточно обильной апотрахеальной диффузной скудной паратрахеальной-вазицентрической типами Древесинные слабогетерогенные гетерогенные одно-трехрядные 20 26 преобладают двурядные тангентальном веретеновидные различной величины вытянутые поперек краевые заостренные Двух-трехрядные могут однорядных окончаний однорядными окончаниями одной однорядные двурядных участка 262 II лежачих лучевых радиальном высоту I обрамляют слои квадратных короткостоячих высота 1.2-1.5 длину такие слои перемежаются слоями лежачих Сосудисто-лучевая иоровость точечная 1.5-2.0 втянутые супротивно диффузно радиальная стенка 8 I клетках лучей аксиальной паренхимы оксалата кальция кристаллический песок 261 I Спиральные утолщения стенках волокнистых элементов Озеров Описание голотип Тело крупное величине Ph строение Ph Ph отличаются некоторыми перечисленными признаками Голова светло- коричневая размытыми серо-коричневыми пятнами дорсальной рострума темно-коричневой широкой полосой рострума скошенной вертикальной темно- коричневой каждым глазом коричневыми участками мандибулах скапусах светло-коричневая темными пятнами Ph остальных частей Ph Строение следующими особенностями надкрылья 1,5 предыдущих видов существенно заходят анальной генитальной 2.3 максимальной дорсального поля содержат дорсальном 7-8 многие двуветвистые трехветвистые медиальной дорсального поля ветви несколько скошенные остальной параллельные густые боковое похоже таковое Ph поперечное жилкование развито остальные гениталий Ph Ph анальная сходна таковой Ph генитальная промежуточная таковыми этих видов гениталии эктопарамерами профиль похожими Ph gran- dis наиболее выдающийся сзади выступ эктопарамеров расположен половине эктопарамеро срединная выемка эпифаллуса трапециевидная угловидная округлая Вариации темной вдоль края переднеспинки может Ph вариации ветвей дорсальном надкрылий.Самка Похожа самца передними ногами генитальной самки Ph яйцеклад последнего вида 1.3 Тело 20-23 19-21 4.8-5.5 4.2-4.8 надкрылья 18.5-19 17-18 13-14.5 25-27 24-25.5 яйцеклад 18-19",0
Семенник один прямой Спикулы сравн тельно 1зентрально изогн ты 1.3-1.5 диаметр т ла области клоаки сравнительно крупнг рулька изогнутых “ лодочек ” Теламон i обнаружен Преклоакльные супплементарш органы Перед клоакой 1зентрал ной чис таких колец 27-35 Хвост дзинный,0
Гагарин Описание голотип Паук мелкий общая 2.1 головогруди 1.0.,0
Л 3.,0
А имеется замкнутая пятиугольная ячейка 2.,0
Р+1.,0
Горохов Описание Размеры голотипа 1078 713 пяти паратипов 1078-1261 730-780 1148 750 соответственно,0
Ж Эта лента проходит стенке правой складки 3.,0
квантовой точки эффект Капицы-Дирака индуци­рованное комптоновское рассеяние Поскольку стоячая волна суперпозиция двух встречных бегуших одинаковой частоты rдe волновой вектор бегуших Согласно вынужденное комптоновское рассеяние электронов стоячей волне интерпретируется дифракция де-бройлевской периодической структуре периодом длина излучения образованной плоскостями фаз пучностей стоячей Если направлением импульса падающего Ро волновым вектором скольжения падающего условие Вульфа-Брэгга имеет вид вероятности ΔG работа образованию размером 5 равная изменению термодинамического потенциала Гиббса образовании Δμ разность химических потенциалов свободного составе σ поверхностное натяжение r0 радиус ceq равновесном сосуществовании обеих фаз D коэффициент диффузии c0 раствора,1
Известно какая-либо фигура группа точек киральной обладающей киральностью если изображение идеальном плоском зеркале совмещено кристаллическая киральность геометрической отнесения кристалла молекулы группе симметрии Такие модификации называются энантиоморфными Эти 22 пространственные киральными группами g симметрии пространственной заданный представлении Вигнера Зейтца rj ri радиус-векторы иона номером j нулевой примитивной ячейке до номером i ячейке после ap возвращающая трансляция h38 43 S43 инверсионный поворот плоскостях ̄110 110 h4 поворот 180◦ h3 h2 повороты этот осей y x.,1
Кустарник метров Ветви темно-коричневые Годовалые сушке чернеющие серовато-шерстисто-опушенные Почки мономорфные 4.5-9 округло-яйцевидные уплощенным отогнутым носиком побега уплощенные килеватые темно- красновато-коричневые шерстисто-опушенные Прилистники 1.5-12 полусердцевидные железистопильчатые Черешки 0.6-2 желобчатые буроватые 2-9 1.5-5 продолговатоовальные продолговато-обратноланцетные острые короткозаостренные ширококлиновидные пильчатые расставленными согнутыми цельнокрайные подвернутые плотные жестковатые сухом состоянии рассеянно-волосистых густо опушенных ярко-зеленые лоснящиеся сизые выступающими боковыми Генеративные листьями соцветий густо-волосисто-опушенные Прицветники 1.6-3 обратнояйцевидные тупые сторон опушение изнутри густое Мужские сережки Нектарники парные адаксиальный двулопастный абаксиальный цельный Тычинок свободными волосисто опушенными нитями Пыльники 0.7 Женские сережки цветках Нектарники цельные двулопастные Завязи войлочно-опушенные Столбик 0.5-1.5 цельный расщепленный Рыльца 0.3-0.7 двулопастные Плоды 6-8 яйцевидно-веретеновидные рыхло войлочно опушенных 0.5-1 смотри вклейку Бакланов маленькие 8-11 эллипсоидные апикальными воротником вокруг проксимального Панцирь типов чешуек воротника куполом асимметричные 1.1-1.4 Купол округлый пиком одна сторона ретикулом ячея окаймляет крупную Щит папиллами которые совместно ребрами формируют чешуйках воротника занимает щита ячея включает Дорзальное субмаргиналыюе ребро развито пересекается штрихами штрихами нижнем вентральном углу располагаются Вблизи субмаргинального отсутствует щита выглядит гладкой Кромка купола дистальный конец кромки плечо Проксимальный край асимметричный 1.8-2.3 1.2-1.4 ориентированы поперек купола ромбические закругленными углами щит ретикулом регулярно расположенные штрихи билатерально субмаргинальных ребер пара штрихов включает Проксимальный край широкий гладкий задняя кромка Транзитные переходные редуцированным 1.2-1.4 1.1-1.2.,0
Голова плоская опистогнатическая выпуклым лбом рисунком светло-бурыми особей подантеннальными кольцами полосками глазного канта окантовкой Верхняя мандибулы базальные золотистые Второй третий Последний нижнегубных веретеновидно утолщен Антенны расширяющейся уплощенной булавой скапус,0
Комарова Описание Голова заметно 43 значительно поперечная посредине 2.7 Темя поперечным Затылок сглаженной ячеистостью Боковые глазки соприкасаются внутренними орбитами удалены равное поперечному диаметру Передний глазок удален равное двум продольным диаметрам Продольный диаметр 1.3 1.36 измеренного Углубление передним глазком небольшое ячеистой Лоб Лобное вдавление четкое небольшое обе продольного Над вдавлением морщинки дугообразно образуя круг Остальная ячейках фоне точки Усики 11-члениковые булава 6-член иковая,0
З 4/1 Лента л1 идет внутри левой складки 4.,0
Пронотум темно-бурый пятен утл ы осветлены Остальные скпериты целиком,0
Хоботок доходит тазиков Последний хоботка стройный заостренный 0.8-0.9 2-го 16-24 дополнительными \в Трубочки чешуйчатые мелкой ячеистости ободками 1г Ободки ясные наклонные Трубочки 0.17 0.19-0.24 1.8-2.3 хвостика Хвостик пальцевидный небольшим сжатием ближе основанию 9-14 Id средне- заднегруди 2-5-м брюшных тергитах полусферические краевые бугорки Дорсальные волоски 3-5-м тергитах 0.022-0.028 0.7-0.8 8-м тергите 8-10 Генитальная широкоовальная диске 11 заднему Ноги головчатыми 1-м членике втором членике 15-24 волоска разной рис.,0
Тело черное Радикула базальная основного 3-5-й апикальная основного булава коричневые Мандибулы зубны красноватым оттенком Ноги исключая тазики,0
И Большое ..,0
Г 3. Д 3. Ж субмембранные 45,0
Мооса ванадиопаргасита уравновешиванием жидкости Клеричи путем постепенного разбавления составила 3.05±0.05 рентгеновская 3.112 электромагнитных сепараторах отделяется магнитную фракцию средне-сильном токе магнитами притягивается Нерастворим Н. С1 HN03 Зарезницкий толбачинского стеклита гексагональные же здесь встречаются многоугольные неправильной пластинчатые индивиды.И те 5-10 поперечнике достигают 0.2 крайне Главная габитусная форма пинакоид Боковые проиндицировать удалось предположительно это или/и сгруктурном исследовании обнаружено микродвойникование Индивиды стеклита зачастую разной степени расщеплены напоминают открытую книгу собраны ажурные агрегаты неправильной сферической стеклит формирует вместе эвхлорином алюмоключевскитом лаш бейнитом гематитом корочки площадью 1.5x2.5 вулканического шлака б .Стеклит Толбачика агрегатах белый сероваго-белого катодных листоватый Стеклит гибки Мооса уг Попытки измерить дали удовлетворительного результата причине ажурного характера 2.792 Стеклит одноосный он бесцветен Мурашко,0
генотипа генетической отдельной особи Следовательно геномом понимают суммарную Д. НК гаплоидного набора каждого внехромосомных генетических содержащуюся отдельной клетке зародышевой линии многоклеточного избыточности некодирующих последовательностей нуклеотидов известен генетике названием парадокса Генетическая информация структуре нуклеиновых кислот заключена молекулах Д. НК Р. НК последовательностей нуклеотидов называемых генами диплоидных полиплоидных клетки содержат одному набору каждого родителей одинаковые хромосомы получили гомологичных гомологов Гомологичными одинаковые хромосомы одного биологического биологической литературе модули подсистемы характеризующиеся высокой степенью интеграции внутренних связях автономностью связях внешних Schlosser Wagner 2004 неформально модуль определяться подсистема проявляющая некоторое автономное von Dassow Munro 1999 морфологическая модульность аспект модульности Eble 2005 Эволюционный модуль определен языке отображений генотип–фенотип genotype–phenotype mapping фенотипических признаков высокоинтегрированных фенотипическими эффектами определяющих генов изолированных других подобных множеств признаков незначительности плейотропных эффектов Wagner Altenberg 1996,1
1.74 Кононова Описание Тело червя широкое неподвижном состоянии уплощенно-овальное стоянии свободного плавания удлиненно-прямое Спереди тело закруглено сужено сзади округлено Передняя дорсальной выпуклая разрезе хвостовой тело уплощается половозрелых червей 3.2- 8.5 наибольшая 3.8 т.е Эти черви гиганты сравнению другими видами рода Р. Иаепосош Р.  polycirra большие размеры Тело непрозрачное собственной пигментации светло-серого бледно-желтого оттенка зависимости съеденной пиши паренхиме симбиотические зоохлореллы количества червей меняется бледно-зеленого темно-зеленого,0
