text,label
"Задние чешуйки асимметричные, с очень коротким шипом.",0
И эту ситуацию хочется назвать имитацией авторства.,1
Обычно каждая пара штрихов включает одну пору.,0
"2. А простая, редко разветвленная, З. А имеет 3-4 ветви.",0
Само расширение выглядит как добавление в метрическую функцию следующего члена разложения по 1/r.,1
"Экзоны – участки Д. НК, копии которых со- ставляют зрелую Р. НК.",1
2V= 50(10)°.,0
"В настоящее время общая теория относительности (О. ТО), являясь общепризнанной теорией гравитации;",1
что оно  (идеальное) является общественно-историческим продуктом;,1
"Целесообразность – закономерность, принцип, аналогичный причинности, но не сводящийся к ней.",1
"Основной механизм, объединяющий людей в массу независимо от характера совместной деятельности, - психологическое заражение.",1
"где L - орбитальный момент, ML - его проекции на ось z, κ - другие квантовые индексы.",1
"Звягинит полупрозрачный до прозрачного, бесцветный, жемчужно-белый, кремовый, желтовато-коричневатый, реже бледно-розовый или сиренево-розовый.",0
"Объект (предмет, продукт) деятельности, имея предметное, внешнее бытие, в то же время выступает как идеальное образование, как пси­хический образ, и таким путем детерминирует психическую деятельность.",1
Темя с поперечным килем.,0
"Она определяется как «навыки, которые позволяют людям распознавать свои эмоции и управлять ими, успешно справляться с конфликтами, понимать и проявлять сочувствие к другим, устанавливать и поддерживать позитивные отношения, следовать этике, вносить конструктивный вклад в их референтные сообщества и устанавливать цели и достигать их»  (цитата).",1
"Реальной единицей такого общения является, по его мнению, высказывание, принципиально отличное от предложения как единицы языка.",1
Вариации.,0
"Глазной мостик узкий, 2-рядный (рис. 2).",0
Минерал не люминесцирует в ультрафиолетовых лучах.,0
"Характерен интенсивный плеохроизм от изумрудно-зеленого (по Ng), желто-зеленого (по Nm), до зеленовато-желтого (по Np).",0
"Таким образом, в рабочем порядке можно определить общение как систему целенаправленных и мотивирован­ных процессов, обеспечивающих взаимодействие людей в коллективной деятельности, реализующих обществен­ные и личностные, психологические отношения и исполь­зующих специфические средства, прежде всего язык.""",1
"К. Ф представляет собой единицу принципиально иного порядка; именно коммуникативные фрагменты, то есть целые готовые выражения, являются первичными, целостными, непосредственно узнаваемыми частицами языковой материи.",1
Остальные скпериты груди целиком темно-бурые.,0
", преобладают двурядные лучи.",0
"Фамулюс (е) конический, короткий.",0
", линейно-обратноланцетные, голые, по краям с крупными, но немногими зубцами или почти лопастные, у основания оттянутые в длинный, бескрылый, бледно-зеленый черешок, на верхушке оетроватые.",0
"Индивиды стеклита зачастую в разной степени расщеплены, иногда напоминают открытую книгу.",0
Попытки измерить плотность минерала методом уравновешивания в тяжелых жидкостях не дали удовлетворительного результата по причине ажурного характера агрегатов.,0
Блеск сильный стеклянный.,0
Мутация – результат нетождественной репарации.,1
и 11-12 мм шир.,0
"Зс и 4d (32-49) тонкие, гладкие;",0
"С таких позиций Бахтин преодолевает монологизм, означающий, по его мнению, «отрицание равноправности сознаний в отношении к истине (понятой отвлеченно и системно)».",1
Жить - значит участвовать в диалоге» (из цитаты);,1
Земная жизнь - это «суета сует».,1
"Существование, жизнь – цель живой системы;",1
Причем орнамент кутикула на разных участках тела разный.,0
"предметом моего действия являются звуки речи, а буквы являются только средством обозначения этих звуков;",1
"Смысл жизни - это не только будущее, не только жизненная цель, но и психологическая «кривая» постоянного ее осуществления.",1
Люминесценция в У. Ф-лучах зеленая (типичная для уранил-иона).,0
"Плоды эллипсоидальные, 13-18 мм дл.",0
"Можно сказать так: всякое значение формы есть вместе с тем ее функция (в том смысле, что выражение этого значения представляет собой назначение данной формы), но не всякая особая функция той или иной формы есть особое значение""",1
"Крыло (рис. 2, 5) с макротрихиями на всех жилках: c макротрихиями, X безмакротрихий.",0
"Похожа на самца, но с передними ногами и генитальной пластинкой примерно как у самки Ph.",0
(цитата);,1
и 15-18 мкм в диам.,0
"его можно определить как «все, что не интеллект»;",1
Фп представляет собой предпосылку и в известном смысле причину определенного поведения данной единицы во взаимодействии с ее средой.,1
«память есть вечное онтологическое начало».,1
"Стебелек поперечный (10 : 34), в продольных резких морщинках, 2-й тергит поперечный (26 : 40), в продольных, довольно густых морщинках, достигающих % длины тергита.",0
Два сравнительно крупнг рулька в форме изогнутых “лодочек”.,0
"Таким образом, коммуникация предстает не как данность, а как заданность.",1
"Прилистники широкосерновидные, с малым количеством крупных зубцов, на стерильных побегах более крупные.",0
"О), формирующими полигональный орнамент.",0
"В выделенных кристаллах заметны грани призм (110) и (010) и нередко видна характерная для амфиболов грубая штриховка, вероятно, на гранях (110) (рис. 1).",0
"Текст - это сообщение, объективированное в виде письменного доку- мента, литературно обработанное в соответствии с типом этого документа, состоящее из ряда особых единств, объединенных разными типами лекси- ческой, грамматической и логической связи, и имеющее определенный мо- дальный характер и прагматическую установку.",1
и 3-5 см шир.,0
"Другой - это любой объект, образ которого проявляется в наших действиях и, соответственно, в формировании нашего «собственного» образа, т.е.  нашей самоидентичности.",1
"Так, например, Н.Д. Арутюнова в «Лингвистическом энциклопедическом словаре» дает следующую дефиницию: «Дискурс (от франц.",1
"где C(φ) - оператор поворота вокруг некоторой оси, 1 - пространственная инверсия.",1
"Сознание рассматривается так же, как тотальность впечатлений, мыслей и чувств, которые создают личность.",1
Зонтички 1-1.7 см в диам.,0
Основным условием научного мировоззрения стали объективность и независимость явления от наблюдателя;,1
"Многолетник с толстым волокнистым корнем и корневищем, несущими спящие почки и цветоносные стебли.",0
"""Умственное действие характеризуется тем же: оно также представляет определенное целенаправленное изменение своего предмета Умственное действие есть умение произвести «мысленное» преобразование предмета.",1
"Стебли одиночные или в числе нескольких, в основании коротко покрытые пленчатыми остатками листьев, 4-17 см выс.",0
"Прицветники линейные или линейно-ланцетные, 4-6 мм длиной, опушенные длинными курчавыми нежелезистыми и короткими железистыми волосками.",0
Длина члеников мак- силлярного щупика (в мкм) 30 : 40 : 84 : 84 : 108.,0
"Так, А.А. Потебня (1976, с. 302), который термином «представление значения» называет то, что у нас именуется «мотивировкой»;",1
"Внешние губные щетинки и губные щетинки объединены в один круп Хейлостома узкая, укреплена склеротизированными ребрами и часто выступает из ротового отверстия.",0
"Однако общение, как это уже отмечалось нами ранее , достаточно многогранное явление.",1
"Системой можно назвать только такой комплекс избирательно вовлеченных компонентов, у которых взаимодействие и взаимоотношения принимают характер взаимо.",1
"I, 3).",0
Антенна с 13 флагелломерами и хорошо развитыми султанами щетинок; длина 13-го флагелломера 544-560 мкм;,0
"Конечно, изоляция как таковая тоже не является направляющим эволюционным фактором.",1
Однако прекращение борьбы за существование и вызываемого ею отбора приспособленных означало бы прекращение жизни как особого способа существовании материи.,1
"Строго говоря, это («геномные мутации») – модификационные (т.е.  ненаследуемые) изменения белков, которые тем не менее влекут за собой наследственные изменения генома.",1
"""Термин ""семантический признак"" обозначает ту часть значения определенной содержательной единицы языка (обычно - лексемы), по которой она противопоставлена другой содержательной единице языка, при условии, что достаточно большая часть их значений совпадает.",1
"Твердость по Моосу В1/», микротвердость, измеренная на П. МТ-3 при нагрузке 150 г (тарированном по NaCl), 1725 кг/мм2 (среднее по 12 замерам, при разбросе 1681-1771 кг/мм2).",0
"Эволюционный модуль может быть определен на языке отображений генотип–фенотип (genotype–phenotype mapping) как набор фенотипических признаков, высокоинтегрированных фенотипическими эффектами определяющих их генов и относительно изолированных от других подобных множеств признаков за счет незначительности плейотропных эффектов (Wagner, Altenberg, 1996).""",1
Р+1.,0
"Чашечки оттопырено опушенные, колокольчатые, с трубкой 2-3.5 мм длиной, с шиловидными зубцами 10-15 мм длиной; прицветники, 8-13 мм длиной, 1.5-3.0 мм шириной, темно-бурые; прицветнички (по 2 при основании чашечки) нитевидные, 5-8 мм длиной.",0
"Прицветники лопатчатые, с расширенным основанием, до 1.5 мм дл.",0
"Соленидии со, на лапках 1, ш на лапках II, ф на голенях III утолщенные, притупленные дистально; другие соленидии длиннее и тоньше.",0
", довольно узкие, зеленые; наружные листочки обертки от яйцевидных до яйцевидно-ланцетных, прилегающие к внутренним, но краям довольно широкобеловатые, почти перепончатые, с заметными жилками, без рожков, внутренние листочки линейно-ланцетные, без рожков или отчасти с едва заметными рожками.",0
"""Первоначальное определение «один ген – один признак» оказалось слишком расплывчатым;",1
Экзокарп из мелких клеток.,0
"Вычисленная из средних значений пт, ng и 2F, эта величина может быть оценена как 1.722.",0
"Углубление под передним глазком небольшое, с ячеистой скульптурой.",0
Мужские сережки 2-2.5 см длиной.,0
"Между парапсидальными бороздами расположены продольные, прерывистые морщинки.",0
"Блеск отдельных пластинок стеклянный, корки матовые.",0
Психика человека формируется как своего рода единство физиологических предпосылок и социальных средств.,1
"Мсндигит встречен в виде несовершенных длиннопризматических, как правило, уплощенных по кристаллов размерами до 0.1 Х0.2.",0
Главная габитусная форма кристаллов - пинакоид {001 {.,0
"Продорсум, нотогастр и аногенитальная область с округлыми поровыми полями диаметром до 20.",0
"Листья 2-9 см длиной и 1.5-5 см шириной, овальные, продолговатоовальные или продолговато-обратноланцетные, острые или короткозаостренные, в основании ширококлиновидные или округлые, пильчатые, с расставленными мелкими согнутыми зубцами или почти цельнокрайные, слегка подвернутые, плотные (жестковатые в сухом состоянии), от рассеянно-волосистых до более или менее густо опушенных, сверху ярко-зеленые, лоснящиеся, снизу сизые, со слабо выступающими боковыми жилками.",0
Рострум широко закруглен.,0
"апелляция к объяснительным редукционистским теориям должна рассматриваться как регресс психологического знания.""",1
"Стебли многочисленные, 20-35 см высотой, восходящие, покрытые чешуевидными коричневыми листьями, опушены короткими и более длинными вниз изогнутыми, нежелезистыми волосками, выше иногда со значительной примесью коротких железистых волосков.",0
"Оно может рассматриваться не только как акт осознанного, рационально оформленного речевого обмена информацией, но и в качестве непосредственного эмоционального контакта между людьми.",1
"тип потенциального соотношения ́система - среда выступает как настоящее актуальное (Фп, требующая связи презентной формы с актуальной ситуацией), другой - как настоящее историческое (Фп, программирующая функционирование данной формы в той среде, которая представлена повествовательным контекстом и ситуацией повествования).",1
"Передняя часть тела с дорсальной стороны более выпуклая, в разрезе почти треугольной формы, к хвостовой части тело уплощается (рис. 1).",0
"ih, ips) - в позициях, типичных для представителей подрода.",0
", снабженные узкими, почти нитевидными и нерасчлененными густо-железистыми придатками, снизу и по краю обильно усеянные стебельчатыми железками, сверху коротко-волосистые.",0
Хоботок доходит до средних тазиков.,0
"Цветки желтые, с пыльцой.",0
"Трубочки составляют (0.17) 0.19-0.24 длины тела, в 1.8-2.3 раза длиннее хвостика.",0
"Автосплайсинг – процесс вырезания интронов из пре­Р. НК без участия белков.""",1
Единичный акт деятельности есть единство всех трех сторон.,1
"На R 8-9 коротких щетинок, на Rl щетинки отсутствуют, на R4 + 5 2-4 щетинки.",0
"(Длина тела самцов 8.9-9.2, самок 9.2-12.2, ширина, соответственно, - 2.5-2.6 и 2.7-2.8 мм.",0
"Членики лапок двуцветные, пятые членики всех ног полностью черные.",0
Поясок с широкой вальвокопулой с вертикальными рядами мелких пор и узкими воротничковидными вставочными ободками с рядами более крупных пор.,0
с ланцетными влагалищами; пластинки 5-8 см дл.,0
относительно Г10011.,0
"Плотность, измеренная в растворе Клеричи - 3.65(3) г/см3, рассчитанная по структурным данным и эмпирической формуле - 3.73 г/см3.",0
"В общем и целом всякое высказывание, по мнению Бахтина, - это живое триединство, включающее в себя отношения, во-первых, к самому говорящему (автору); во-вторых, к другим участникам речевого общения и к их высказываниям; в- третьих, к предмету, о котором спорят.",1
"Иными словами, текст – это не что иное как взгляд на дискурс только с точки зрения внутреннего (иманнентного) строения речевого произведения.",1
Внутренние губные сенсиллы в форме мелких папилл и едва заметны.,0
"Пресекторальное поле переднего крыла с 5-8 поперечными жилками (обычно 6- 7), заднего крыла - с 4-7.",0
"Кристаллы толбачинского стеклита - гексагональные пластинки, чаще же здесь встречаются его многоугольные, неправильной формы, пластинчатые индивиды.",0
"Зубцы чашечки ланцетные или треугольные, почти равные или немного короче.",0
"сам полезный результат является, несомненно, функциональным феноменом, мы и назвали всю архитектуру функциональной системой.",1
"Дело в том, что для самого субъекта осознание и достижение им конкретных целей, овладение средствами и операциями действия есть способ утверждения его жизни, удовлетворения и развития его материальных и духовных потребностей, опредмеченных и трансформированных в мотивах его деятельности. .личностный смысл – это всегда смысл чего-то: """"чистый"""", непредметный смысл есть такая же бессмыслица, как и непредметное существо.",1
Жилки крыльев желтоватые.,0
"В проходящем свете минерал зеленый, без дисперсии и плеохроизма.",0
