text,label
ИВ.,0
Первоначальное оказалось слишком расплывчатым фермент оказалось неточным полипептидная цепь устарело бактерий возможно участок Д. НК кодирующий первичную полипептидной цепи Н. К t.,1
Умственное характеризуется определенное Умственное умение произвести мысленное преобразование предметом моего действия звуки буквы средством обозначения звуков Сохранение сокращенной части условием сознательности общим пониманием конкретно-исторически обусловленного способа единица себе объективно-социальное субъективное психологическое обладающая своеобразной внутренней структурой орга­низацией во-первых социальной последняя своем объекту реализуемым общественным отношениям категория философско-социологическая каких-либо попыток перевода план конкретно-психологической интерпретации предмет имея предметное внешнее пси­хический детерминирует психическую про­цесс активного вмешательства мир предметного Созна­ние продукты мо­менты вообще условие актуализации общественных Мое всеоб­щее чего реальная коллективность Далее непосредственной реализацией общественных условно говорить контакте коммуни­кация воспринимается синоним несет определенную нежелательную методологическую нагрузку рабочем порядке систему целенаправленных мотивирован­ных процессов обеспечивающих коллективной реализующих обществен­ные личностные психологические исполь­зующих специфические,1
Вьюрки плохие летуны чрезвычайно важным фактором формообразования препятствующим вторичной нивелировке Конечно таковая тоже направляющим эволюционным фактором Популяционные флуктуации некой моды изоляцией перерыв полное нарушение панмиксии первыми случаи какие-либо посторонние живому организму факторы препятствуют полному перемешиванию Биологической изоляции сдвиг гнездового периода опять-таки направляющий фактор эволюции фактор филогенетической дивергенции,1
образующими нотогастре прерывистые полосы Постботридиальная нотогастральные полосы выражены сравнению ювенильными стадиями видимы расчлененных экземплярах,0
особую разновидность языкового творческого акта имеющую параметры отличные параметров устной текстом Ю.М Лотман понимает сумму структурных нашедших лингвистическое Л. Долежел наоборот автономную семиотическую Итак письменного варианта Topic главная тема основное focus выделения маркированных словосочетания фразы предложения linkage объединения отрезков Л. Долежел среди основных параметров мотив motif главное проходит через весь пишет собойсообщение снимается энтропия порождаемая отдельным предложением обладает собственной предикативностью отличной предикативности входящих него Сверхфразовое замкнутую наличии нем деиктических семантический обозначает ту определенной содержательной лексемы которой противопоставлена содержательной единице условии достаточно большая значений совпадает синтаксический теоретический конструкт позволяющий записать синтаксическую информацию рассмотренных случаях информацию особенностях управления сокращенном обобщенном описывается высшая ступень та ступень Степанов Ю. 1975 13 отражает общие существенные признаки познанные общественной практике Мотивировка наименования тот делается представителем понятия -это несомненная С. Д Равным столовая комната принимают пищу учреждение общественного питания Точно столяр рабочий занимающийся обработкой дерева пилением изделий него любых деревянных изделий столов одуванчик мотивирующая С. Д производна дуть еще пухлянкой мотивирующая С. Д производна пухлый А.А Потебня 1976 302 термином нас именуется мотивировкой лексическое аптека толкуется учреждение изготовляются продаются лекарства Словарь Ожегова Если семемы вычесть понятийные С. Д остатке окажется непонятийных С. Д Эту именуем лексическим фоном Лексический взятые вместе непонятийные С. Д входят семему участвуют опосредованной языком классифицирующей эти С. Д выполняют немаловажные функции чем будет сказано ниже Эти непонятийные С. Д входящие лексический теперь принадлежности фоновыми С. Д идет присутствия некоторого качества минимум сведений дереве Потебне ближайшее максимум ботаническом описании дальнейшее предложен В.В Виноградовым важнейший инструментов стилистического художественной представлений авторское составляющих структуры оставшиеся тематическая основа рематический сюжет Модусы принадлежность показатели метатекста особые текстовые нити Вежбицка 1978 сплетаются авторский узор Первое важное выявленность роли скромный информатор объективированной каких позиций отношению репортёр участник событий повествующий них достигающий эффекта присутствия иногда вербальных визуальных фото аналитик рассуждающий значимости тех иных событий последствий выносящий обоснованные аргументированные оценки Вторым свойством степень сложности эту ситуацию хочется имитацией авторства клавитурщик технический создатель никак выражающий позиции обсуждаемым проблемам Третий параметр стилистического удельный вес этим параметром имеется виду относительное текстовое пространство отведенное авторское,1
Коргина Описание Имаго среднего размера муравьиные львы прозрачными крыльями 24-33 мода 27 23-29 обоих полов 18-25,0
Описание 6.0-8.8 0.8-0.9 наибольшей пронотума Наличник предвершинной блестящей областью слабыми переднем крае базальным срединным Скапус отчетливо килями нижний пластинчатый верхний слабый Глазки маленькие отношение POD OOD 0.9 задним глазком задним краем 1.2-1.3 OOD Лоб продольной бороздкой заметной усиковых бугорков усиковым бугорком глазом развит Затылочный отчетливый он продолжается острый защечный треть затылочным ротовой ямкой Третий усика флагелломер 1.6- 1.7 своей 3.8-4.0 2-го 0.7 4-го последнего 1.0- 1.05 5-гс Мандибула 3-зубчатая большим нижним зубцом высота сбоку наименьшего выемкой верхним мандибулярным Лоб темя сливающейся пунктировкой,0
"члениками количестве линзовидными сетчато-морщинистыми коротко-опушенными рассеянно коротко-шиповатыми Князев Многолетнее растение диаметре длинным стержневым Стебли приподнимающиеся распростертые прижатыми молодом возрасте Прилистники яйцевидно-треугольные 1/3 сросшиеся 3-6 зеленые позднее буреющие 4-14 18 дважды- триждынепарноперистые негусто белореснитчатые 5-13-парные продолговато-овальные ярко-зеленые ланцетные сизоватые густого опушения верхних ланцетно-линейные длинно заостренные мозолистые Черешки 3.5-8 так же ось рассеянно прижато мелковолосистые Цветоносы прижатыми Кисти продолговато-яйцевидные 3-4.5 цветки поникающие Прицветники лопатчатые расширенным цветоножек негусто черноволосистые Чашечка косым зевом 4.5 прижато-черново- лосистая зубцы узкотреугольные 1.5-2 трубки ей Венчик белый синевато-белый фиолетовым лодочки Флаг 8-12 широкояйцевидная неглубоко выемчатая ноготка Крылья 7-10 продолговато-ланцетные 1,6 Лодочка фиолетовым Бобы ножке равной поникающие неравнобокие несколько изогнутые 7-13 3.3 брюшке килеватые спинке грехгранные перепончатые прижато черноволосистые двугнездные Носик бобов прямой слег ка извилистый Семена Кузнецова Растение многолетнее поликарпическое темно-зеленое голое Клубень шаровидный заглубленный Стебли 15-40 подземной утонченные выполненные тонко щитковидно ветвящиеся дуговидно отогнутыми ветвями Прикорневые очертании трижды тройчатой 3-7 шир Конечные сегменты пальчато рассечены Конечные сегментов 0.5-1 концах внезапно переходящие короткое остроконечие прикорневые мельче Средние верхние продолговато-ланцетном белопленчато-окаймлеином влагалище Самые верхние рассеченной нитевидные Зонтики 3-8 -лучевые Зонтички 1-1.7 8-10-цветковые оберточки цветоножек сколько Зубцы Лепестки белые обратно-сердцевидные выемчатые короткой загнутой вовнутрь заметным секреторным канальцем Подстолбие коротко-коническое валиком Стилодни 0.5 дуговидно отогнутые Плоды трудом распадаются мерикарпия колонка цельная Зрелые мерикарпии 3.5-4.2 0.6-1 спинке вальковатые четко выступающие комиссура средняя плоды округло-пятиугольные экзокарп мезокарп паренхимных Секреторные септированные одному крупному ложбинке комиссуральной Эндосперм плоский Лазьков Невысокий кустарник 50-100 выс Шипы согнутые боков овальным рахис листа волосистый железистый немногочисленными шипиками прилистники развитые заостренными ушками 11-18 усеянные единичными удлиненно-эллиптические 14-25 8-14 клиновидные длинно заостренной единичными жилке железок сложно-зубчатые концах зубцов Цветки соцветиях железисто-щетинистые 10-20 чашелистики 25 снабженные узкими нитевидными нерасчлененными густо-железистыми придатками обильно усеянные стебельчатыми коротко-волосистые Диск развит зев головка рылец бело-шерстистая Плоды эллипсоидальные 13-18 11-12 железистые Миронова Кустарник невысокое дерево опушенными молодыми побегами кора ветвей серая колючки малочисленные вовсе почки шаровидные темно-зеленые рассеянноопушенные курчавым опушением черешками 1.5-2 листовые цветущих побегов широкояйцевидные широкоэллиптические 3-6 клиновидным широко-клиновидным 3-5-лопастные 1/3-1/2 лопасти тупые крупными выемки трети Листовые стерильных побегов 6-7 шир 5-7-глубокораздельные 2/3 нижняя пара лопастей отделена остальных выемкой расположенной 1/4-1/3 Прилистники широкосерновидные малым количеством зубцов стерильных побегах Соцветие многоцветковое рыхлое щитковидное гипантии курчавым опушением уменьшающимся мере созревания плодов чашелистики яйцевидно-треугольные широкотреугольные приподнятые прямостоячие тычинок 18-20 стилодиев свободных плоды шаровидные небольшие 0.7-0.8 суховатые Плодоношение конец VIII-IX",0
Грудь Темно-коричневая латерально Акростихальных шетинок среднеспинки начинаются недалеко границы спинкой Дорсоиентральных преалярных щитке,0
"Интегумент 1,2 красно-коричневая Покровы микроямками видимы иммерсионным объективом х. ЮО.",0
В 3. Д 3. Е 4. А Лента л2 проходит близко л.,0
Она Основной объединяющий массу независимо характера совместной психологическое заражение Сигнал материальный носитель служащий упорядочиванию связей сложный адаптации целостного растения внешним условиям A.Trewavas Trewavas 2003 разумным суммой кооперацией адаптационных процессов осуществляемых разными клетками органами искомого растения животных экстренному решению новых задач см Зорина Полетаева 2003 понятием антиципации избирательно относиться воздействиям предвосхищать см Сергиенко 1992 Г.Г.Филиппова использует интеллектуальная соответствии ситуативными неповторяющимися изменениями Филиппова 2004 177 А.Ф.Корниенко постулирует нет нет психики Корниенко 2007 128 Последней особенностью психического которую считаем важным обратить внимание осуществляя интеграцию ориентацию внешнем освоения последнего обязательного звена предполагает освоение учет внутреннего объективной реальности тела Следовательно психику необходимо во- первых внешнего во-вторых интеграции отражений единого вызревающего необходимого регулирования наибольшей полнотой реализовать Критерием наличие отсутствие жизненной концепции известной характеризует теоретический личностью смыслом любого поступка принято внутренне мотивированное индивидуальное иного поступка широком переживание ценности выработки присвоения Такая потребностью самовыражении самореализации проявлении чем еще говорить Естественно условия люди признании связана первой менее самостоятельную сторону Содержанием труд становится ведущих мотивов потребностей чему-то будущая определяемая мотивом переживание имеет место реализации данного мотива психологический переживания будущее жизненная психологическая кривая постоянного переживать удовлетворяться наш взгляд переживать жизненных проявлений индивидуальности выражает притязания стремления потребности важно подтверждением достижений реальной выразить будущее перспектива мера достигнутого оценка достигнутого своими силами существенным критериям Смыслу противостоит отчуждение лишение действии поступков ценности значимости функциональные ответственность осуществление связан потребностью способностью самостоятельно свой страх риск строить осуществлять,1
Развитие антропоцентрической лингвистикиназывают дискурсивным переворотом гуманитарных науках наблюдаемая лингвистическая моделируемый основным связующим звеном коммуникантами объектом сущностная предопределена А.Е.Кибрика Речевые структура дискурса отражением выражением особенностей числе коммуникативной компетенции Индивидуальное диалектически взаимосвязанные Конкретное языковое социально детерминированное Индивид собственник содержаний ответственная желания индивид чистым социально- идеологическим явлением Там 40 Такое позволяет определенную группу носителей имеющую сходные речеповеденческие коллективную языковую Уникальность конкретного индивидуума неповторимость комбинации социально- психологических характеристик словом дискурс целостное речевое многообразии когнитивно-коммуникативных Н.Д Арутюнова Лингвистическом энциклопедическом словаре дает следующую дефиницию Дискурс франц discours связный экстралингвистическими прагматическими социокультурными психолингвистическими др факторами взятый событийном рассматриваемая компонент участвующий взаимоотношении механизмах когнитивных процессах Дискурс погруженная Дискурс объективно существующее вербально-знаковое построение сопровождает социально-значимого Иными словами взгляд дискурс точки внутреннего иманнентного строения деятельностью разновидность направленной осознанное порождение целостных дискурсивным мышлением особый вид вербального обслуживающего процессы порождения смыслового восприятия дискурсов Представляется уместным введение термина дискурсивная компетенция составляющая коммуникативной компетенции позволяет измерять уровнь сформированности умений осуществлении эффективной результативной современной мышление знаковый дериват внешней предметной Тарасов Уфимцева 1985а 51 Универсально-предметный код словам Жинкина охарактеризован некоторыми общими чертами Знаковый материал кода нейрофизиологические следы репрезентативно-двигательных коммуникативных передачи жестового мимического интонационно- звукового т.д.,1
