text,label
НК Н. К участок Д. НК образуется функциональная молекула Н. К Поскольку ряде случаев интроны части оказывались кодирующими экзоны некодирующими правильнее экзонами Д. НК составляют зрелую Р. НК интронами внутренние районы гена удаляются первичного транскрипта отсутствуют зрелой Р. НК Экзоны Д. НК со- ставляют зрелую Р. НК Интроны Д. НК удаляются первичного транскрипта отсут­ ствуют зрелой Р. НК Сплайсинг вырезания пре­Р. НК копий сшивание копий экзонов существу сплайсинг последовательные реакции трансэтерификации Р. НК проходящие автокаталитически помощи ферментов рибонуклеопротеидных комплексов сплайсосом Альтернативный сплайсинг нескольких зрелых Р. НК одинаковых пре­Р. НК исключения некоторых экзонов и/или оставления Автосплайсинг вырезания пре­Р. НК участия,1
Ермилов Сравнительно черви Кутикула кольчатая орнаментирована Причем орнамент кутикула разных участках разный переднем уровня фаринкса орнаментированы палочковидных склероций пищевода отдела кутикула узкие латеральные гребни составленные продолговатых склероций лате- рально каждом кольце кутикуле грубая кольчатость латеральных гребней Соматические губ обособлена Губы низкие Внутренние сенсиллы папилл Шесть внешних губных сенсилл заметных Четыре головные сенсиллы 2.0- равно 22-26 области губ Внешние объединены один круп Хейлостома укреплена склеротизированными ребрами выступает ротового отверстия Эзофастома бокаловилная вооружена крупным дорсальным зубом субвентральными зубами Фовеи щели двойным конту ром кутикул фовей 7.0-7.5 равн ется 80-85 данном уровь впереди фонзей субкутикуля ном слое кутикулизированнг конусов Фаринкс мускулистый расшир ется своему основанию терм нального бульбуса Просвет фаринкса тикулизирован Ренетта мешковидная 35-45 1зентрально уров отдела кишки Экскреторн пора локализуется позади нервного кол ца,0
Красч 50° Оптическая ориентировка Nm b.,0
усеченная блестящая серо-желтая темным головным отделом Хелицеры 0.5 грязно-коричневые покрыты несущими Желобок хелицер переднему покрытыми мельчайшими Сбоку хелицеры расширенным выступающим вперед пределы головогруди Нижняя продольная серо-желтая тонкой белой Максиллы серо-желтые шагренированы хелицеры беловатой вершиной Стернум сердцевидный желтый Брюшко серое дорсально редкими черными Ноги бедро I зачернено,0
Грудь выпуклая равной высоты 43 52 Сред неси инка парапсидальными бороздами достигающими Уг грубоячеистой парапсидальными бороздами прерывистые морщинки Цитик 28 ячейки среднеспинке Заднеспинка глубоких ячейках Мезо- метаплевры блестящие Стигмальная 4.3 маргинальной 1.4 постмаргинальной 4.5 бахромка этих короткая,0
Крылья Коричневатые 2.08 R 8-9 Rl R4 Костальная заходит вершину R4 40-48 Вершина R4 находится дистальнее М3 Си изогнута Анальная лопасть развита округлая,0
Епифановит Показатели света волны Np= 1.708 Nm 1.730 1.735 2.,0
Юревич 2006 106 апелляция объяснительным редукционистским теориям должна регресс психологического знания,1
Социально-эмоциональные концепция близких смыслу отличающихся контексту употребления отечественной навыком принято доведенное до автоматизма многократных повторений англо-американской традиции Colman 2015 навык skill сложно организованный поведенческий паттерн приобретаемый тренировки практики Однако обеих традициях навык формирующееся через тренировку практику социально-эмоциональная компетентность чаще встречается контексте образовательного позволяют людям распознавать эмоции управлять ими успешно справляться конфликтами проявлять сочувствие другим устанавливать поддерживать позитивные следовать этике вносить конструктивный вклад референтные сообщества устанавливать цели достигать Payton et al. 2008 Durlak et al. 2011 Чаще используется калька английского мягкие индивидуальные позволяют человеку эффективно гармонично взаимодействовать рамках профессиональной soft skills комплекс черт социальных умений креативности навыков дружелюбия оптимизма важных работе развиваемых целенаправленного воздействия Еще широко используемый некогнитивные пришел экономических исследований ним относится рациональным аспектам принятия экономических решений Heckman Kautz 2013 интеллект XXI века описывает навыков обеспечивает согласованность интеграцию сфер достижения успеха современном многогранный взаимовлияния друга осознанного рационально оформленного обмена информацией непосредственного эмоционального контакта Естественны такие подходы определению последнее характеризуется личностного Однако отмечалось ранее достаточно многогранное другу обмен информацией духовное взаимопроникновение форм человеческого получающей широкое распространение влиянием научно-технической революции многоканальная многократно опосредованная духовная А.А Леонтьев работ писал интериндивидуальный социальный изолиро- ванного социальную группу общество Анализируя эту точку Б. Ф. Ломов отмечал нашему противопоставление социального интериндивидуального неправомерно сущности единичного общего.,1
Хомяков Канонеровнт тонкую белоснежную корочку кварца топаза касситерита эта корочка радиально-пластинчатых величиной кристалликов долей миллиметра чрезвычайно хрупких разрушающихся иглой агрегатах канонеровита кое-где позднее отложился тонкочешуйчатый желтовато-белый мусковит единичные стеллерита,0
Уг-3 Звягинит видны еще направления перпендикулярные так 2.88 структурных данных 2.94,0
Отдельные канонеровита сростков бесцветные моноклинной сингонии внешней симметрией 2/т габитусными гранями е малоразвитыми всегда проявленными результатам гониометрических измерений применением столика Федорова удлинены уплощены рисунок Моосу слабая 1.91 определена гидростатическим водном Клернчн п 427 иммерсии отрицательным удлинением близким прямому угасанием cNp 0-7° возможно из-за расщепления 1.459 пр 1.453 двупреломленне 0.005-0.006 воде растворяется дает реакцию фосфор NH^MoCH после растворения HNO3,0
ряда Глазное поперечное трапециевидным срединным полем медиальные мельче сближены расставлены,0
V ′ псевдовекторное пространственной знак ⊗ означает прямое матриц базисной Lz -компонента антиферромагнетизма равная разности проекции спинов атомов ось z.,1
ЫЧ 55° Дисперсия оптических осей слабая < v.,0
Старова Владимиривановит Тултуйского месторождения темно-синей чернильно-синей окраской неоднородной пятнистой черты темно-синий темно-синий чернильно-синий неоднородный Ляджвардаринском месторождении голубого сине-зеленого темно-синего окрашен неоднородно голубая синей голубой-темно-синий неоднородный Макроскопически штуфах непрозрачен шлифах стеклянного жирного блеском слабой спайностью хрупок микровдавливания VIIN 522-604 кге/мм2 VIINcp отпечаткам 575 кге/мм2 соответствует 5.5 Мооса Измерения проведены микротвердометре У. И П. МТ-3 нафузке г.  отпечатки сопровождались микротрещинами « усиками » из-за хрупкости плоскими асимметричными выколками владимиривановита Тултуйского месторождения 2.436 Значение плотности измеренное жидкостей 2.48 Сапожников мариинскита темный насыщенно-зеленый видимый ярком освещении светло-зеленый сильный сколах раковистый Моосу В1/ » микротвердость П. МТ-3 нагрузке 150 тарированном NaCl 1725 среднее 12 замерам разбросе 1681-1771 определенная жидкости Клеричи 4.25 4.25 Мариинскит коротковолновом 254 длинноволновом 315 ультрафиолетовом катодных прозрачных шлифах мариинскит изумрудно-зеленый светлый эсколаита Характерен интенсивный плеохроизм изумрудно-зеленого желто-зеленого Nm зеленовато-желтого Np Схема абсорбции Nm Np,0
пятый 0.51-0.53 шестой 0.88-0.91 0.17-0.18 -I- 0.71-0.73 трубочки 0.67-0.74 хвостик 0.38 последний хоботка 0.15 второй 0.17 жизни Тело светло-зеленое сочленения красные препарате Тело светлое 3-5-го 6-й голеней светло-бурые,0
Крылья прозрачные двуцветным жилкованием практически светлыми промежутками Си.,0
Попова Физические свойства оптические характеристики Епифановит бирюзово-голубой бледно-голубую черту отдельных корки матовые Мооса хорошая отдельности наблюдалось Клеричи 3.65 рассчитанная структурным данным формуле 3.73,0
любое функциональное результатом включения конкретную ходе которой активно преобразуется обусловливая успешность реализации Исходя сказанного функциональное звено системной реакции проявляющееся интегрального динамического комплекса наличных характеристик тех качеств нервных прямо косвенно обусловливают выполнение,1
Лелей Описание Имаго Темно-коричневый 3.15 Отношение 1.51,0
ширина спектра средняя излучения Солитоны локализованные нелинейных механизмов разделяются два класса t mp масса атома вертикальная координата g ускорение свободного падения Редкоземельные TM переходные B атомы бора Ключевой шума спектральная плотность W f характеризующая распределение мощности случайного сигнала частотному спектру f Сплавы серии новое четвертое поколение супермагнитов широко используемых технологиях прецизионных навигационных приборов устройствах спинтроники,1
А целиком Пресекторальное 6- 4-7 Прекубитальное простое Кубитоанальное однорядное добавочных 2.,0
Чуканов Арангасит обнаружен среди кварц-мусковит-турмалин-суль- фидных жил околожильных грейзенов тесном срастании ним,0
Мыльников Мооса рав Ферроиндиалит раковистым изломом наблю дается жидко стях 2.66 фор мулы параметров элементарной ячейки 2.667,0
Ь 4с 65-82 Зс 4d 32-49 1с 41- дерете новидные Аногенитальная 9-13 Имеется генитальных анальных аданальных Медиальные генитальные 57-65 латеральные 98-114 толще гладких перед не-латеральных Анальные 69-82 Аданальные adx 164-168 заметно ad2 114-131 ad2 98-110 adA 98-110 опу шенные Лирифиесуры iad,0
"представления Γ2 базисной компонента Mz суммарного магнитного момента S1z + S2z L орбитальный момент ML проекции ось κ квантовые индексы C φ оператор поворота пространственная инверсия было названо апокампическим разрядом апокампом Окончание отростка источником плазменных пуль представляющих светящиеся следы распространения ионизации скорость примерно 200 км/с 9,15,16 апокампом якобы воздействие позиция Реальной отличное предложения короткая однословная реплика бытового разговора большой роман научный трактат предложение законченная мысль соотнесенная мыслями первая основная особенность смена общем Бахтина живое триединство включающее во-первых самому говорящему автору во-вторых другим участникам высказываниям в- третьих предмету спорят особые смысловые членами целые которыми стоят выражают реальные потенциальные речевые субъекты видели Бахтина взаимосвязи репликами реального беседы дискуссии наглядным простым видом диалогических таких позиций Бахтин преодолевает монологизм означающий отрицание равноправности сознаний истине понятой отвлеченно системно исходном точном диалогом живое участники духовно обогащают друга выражают преобразуют развивают чувства вы- рабатывают общую позицию наоборот остаются взглядах теперь уточненных нее вышеуказанный современников исходную яркую форму непосредственного лицом лицу беседы дискуссии эти многие типы диалогических весьма разнообразные социальности психики Бахтин выражает следующим Единственно адекватной словесного подлинной незавершимый природе диалогична Жить значит участвовать диалоге почти всё подлежащая пониманию первичная реальность исходная точка всякой гуманитарной дисциплины пишет Точные науки монологическая знания вещь разные предметы познания Говорилось „ сбивчивый главным сугубо индивидуальный связанный накоплением трансформацией организацией проявление духовной распространенных трактовок совместное знание Joint or Mutual Knowledge представители психоаналитического направления толкуют сознательное превращения бессознательного процедурах психотерапии анализанд приходит такому пониманию состояния раскрывается аналистом других концепциях соотнесение индивидом субъективного социально-выработанными образцами Современный радикальный бихевиоризм трактует оперантное обусловливание вербального Другая объявляется внутренним знанием убеждением выражается оценке собственных состояний Человек рефлексивное животное способное создавать самое интериоризации наблюдений осуществляемых отношению нему тотальность впечатлений чувств создают некоторая целостная установка эпизоды умственной перечисленных подходах трактуется нечто вытекающее интегратор внутренней впечатлений переживаний Марксистская психология функцию представляющую человеческое Специфика формирующееся развивающееся исторического отмечает Э. В. Ильенков индивидуально-психологический физиологический общественно-исторический духовного производства -писал Маркс -с им пока вообще существуют люди Труд писал Маркс совершающийся природой человек собственной деятельностью опосредствует регулирует контролирует обмен веществ природой отмечалось индивидуально- психологическим общественно-историческим фактом общественно-историческим продуктом знаковые заместитель стоит общественная практика откристаллизованная значениях История промышленности отмечал Маркс возникшее предметное промышленности раскрытой книгой человеческих сущностных сил чувственно представшей перед психологией существует обществе системное качество Общественные идеи взгляды настроения п нечто витающее над формирующиеся идеи взгляды настроения живущих действующих исторических условиях",1
Сидоренко Ванадиопаргасит преимущественно гипидиоморфные коротко- длиннопризматические 0.10-0.80 X 0.05- 0.10 выделенных кристаллах призм видна характерная амфиболов грубая штриховка вероятно Пирамидальных окончаний наблюдалось образцах бинокуляром ярко-зеленый изумрудно-зеленого порошок бледно-зеленый неровный Микротвердость П. МТ-3 нагрузка составила 752-824 17 замеров 795 т.  е.,0
звягинит плеохроирует Показатели измеренные иммерсионных X Np 1.626 Nm 1.714 Ng= 1.740 Угол 2V оцененный кривизне балки разрезе перпендикулярном оптической 45 ° 2.,0
Яковенчук Урамарсит несовершенные пластинчатые кристаллиты пленочные образования встречается уплощенных квадратных размеров основными формами светло-зеленый олеск пленках матовый Люминесценция У. Ф-лучах зеленая типичная уранил-иона спайностью Мооса,0
