text,label
"Иными словами, психология есть современном этапе теория и.   же такое лингвистика? - учение об одной сторон видов  аспектов - именно речевой ""основной единицей языка употреблении слово, предложение,» (из цитаты); также понимание термина «абзац»  семантико-синтаксической единицыуже осознано лингвистический факт.",1
"Соцветие многоцветковое, рыхлое, щитковидное; цветоножки гипантии курчавым опушением, уменьшающимся но мере созревания плодов; чашелистики яйцевидно-треугольные широкотреугольные, при плодах приподнятые прямостоячие; тычинок 18-20; стилодиев -, свободных; плоды шаровидные, небольшие (0.7-0.8 диам.), черные, суховатые.",0
"Значение плотности, измеренное методом тяжелых жидкостей, составляет .48() г/.",0
Л Ж).,0
Тегмен прямоугольной формы тонкими склеротизо- ванными отростками.,0
"Тычинок , свободными, волосисто нитями около .",0
", прямой слегка извилистый.",0
". Листья 0-30  иной ( треть превышающими рахис), листочки числе -() пар, эллиптические, 20-35 -15 шириной (, .- раза превышающей ширину), обеих сторон густо полуприжато .",0
", равны чуть короче цветоножек, негусто черноволосистые.",0
"Окончание отростка служит источником плазменных «пуль», представляющих светящиеся следы распространения волн ионизации, скорость движения составляет примерно 200 км/с . Именно она называется апокампом.                    ь - якобы поведение,   поведение -  Она (субъекта) - только воздействие, изменение мира, но общественный акт, позиция.",1
"Иногда стеклит формирует, как правило, вместе эвхлорином, алюмоключевскитом, лаш бейнитом гематитом, тонкие корочки площадью .x.  поверхности вулканического шлака (рис. , б).Стеклит Толбачика прозрачный, бесцветный, агрегатах белый сероваго-белого.",0
Бескрылая живородящая самка (изучены 13 экз.).,0
"Понятие soft skills определяется комплекс черт личности, социальных умений, креативности, языковых навыков, дружелюбия оптимизма, важных работе развиваемых результате целенаправленного воздействия.",1
"Межсосудистая поровость точечная очередная, окаймленные поры расположены свободно.",0
головогруди .0.,0
"Максиллы серо-желтые, продольные, шагренированы как хелицеры, беловатой вершиной.",0
Самец (голотип).,0
"Воплощение смысла значениях – глубоко интимный, психологически содержательный, отнюдь автоматически одномоментально происходящий.",1
"Смысл -  только будущее, только жизненная цель, но психологическая «кривая» постоянного осуществления.",1
"Адоральные гладкие: ог) (32-41) листовидные, силь- но расширенные редин но-проксимальной; ог2 (61-49) листовидные, расширенные срединной ; ог (41-49) утолщенные, щетинковидные.",0
"Биология – наука о живых (биологических), изучает преимущественно характерные  специфические признаки, свойства живых, отличающие живые от неживых.",1
"отмечает Э. В. Ильенков, «идеальное есть индивидуально-психологический, тем более физиологический факт, факт общественно-исторический, продукт духовного производства» (цитата);",1
"индивидуальные характеристики, позволяют эффективно гармонично взаимодействовать другими рамках своей профессиональной.",1
"Стеблевые листья яйцевидно-ланцетной пластинкой, 10-15, - шириной, верхушке островатые,  краю волнистые, островато-зубчатые, -8 зубцами, широко-клиновидные, черешках -, серо-зеленые, сверхус вдавленными жилками, едва шероховатые, снизу выступающими жилками, короткими, более менее оттопыренными нежелезистыми, пазухах нижних листьев развиты удлиненные стерильные, реже фертильные побеги.",0
Растение 60-80  выс.,0
"Клетки очень маленькие, 8-11 мкм, - мкм шириной, обычно эллипсоидные, апикальными воротником вокруг проксимального конца жгутика.",0
Некоторые кристаллы полисинтетически сдвоиникованы (100); компоненты двойника связаны матрицей перехода.,0
"Лоб продольной срединной бороздкой, более заметной около усиковых бугорков.",0
"Дело том, для самого субъекта осознание достижение им конкретных целей, овладение средствами операциями действия есть способ утверждения его, удовлетворения развития материальных духовных потребностей, опредмеченных трансформированных мотивах  личностный смысл – всегда смысл чего-то: """"чистый"""", непредметный смысл есть такая же бессмыслица, непредметное существо.",1
"Ноги бурые, желтым рисунком, черных редких шипах.",0
"Си, изогнута.",0
"Покровы ног микроямками (видимы только под иммерсионным объективом, х. ЮО.",0
Передние средние бедра основан им трихоботрией - характерным сенсорным.,0
"Цветки розовые, розоватые, желтоватые.",0
", верхней расширенная, изогнутая, довольно сильно выставляется из чашечки, верхняя губа .-, почти рассеченная широко-обратнояйцевидные доли, нижняя губа -, полукруглыми . .0-.",0
"лучи числе -17, слегка неравные, -. .",0
"трудовая есть простая совокупность трудовых действий, есть беспорядочное проявление организма, точно так же речевая есть совокупность речевых актов, совокупность «брошенных» высказываний.",1
"Однако общение, уже отмечалось нами ранее , достаточно многогранное явление.",1
"Конечные доли сегментов линейно-ланцетные, -.",0
"Трихоботрии (55, 168-176) гребенчатые, 7.",0
"Лодочка 7-11 шириной, 14-19.",0
Трубка венчика.,0
сбоку)  раза больше наименьшего расстояния между выемкой верхним мандибулярным килем.,0
"Голова светло- коричневая несколькими размытыми серо-коричневыми пятнами дорсальной бокам рострума, темно-коричневой широкой срединной полосой вершины рострума середины наличника, скошенной вертикальной темно- коричневой полоской под каждым глазом коричневыми участками мандибулах скапусах; переднеспинка светло-коричневая темными пятнами приблизительно как у Ph.",0
"«История промышленности,- отмечал Маркс,- возникшее предметное бытие промышленности раскрытой книгой человеческих сущностных сил, чувственно представшей перед нами человеческой психологией» (цитата);",1
Психология соответственно выступает учение об стороны содержания отношении ее субъектам.,1
"согласно функция способ поведения, присущий к.-л.",1
ультрафиолетовых катодных лучах минерал  люминесцирует.,0
переднем конце уровня конца фаринкса кольца кутикулы орнаментированы рядами палочковидных мелких склероций.,0
Двугубые выросты расположены между глазками.,0
"(из цитаты) Наконец, результат целого организма также «судом последней инстанции».",1
"Столбик почти равными, назад изогнутыми рыльцами, короче верхней губы.",0
Паук мелкий; общая ..,0
"по: Гайсинович, 1988).",1
"светло-зеленое, сочленения усиков светло-коричневые, глаза красные.",0
", немного неравные, слегка ребристые.",0
эмпирическая выборка во временной точке могла бы считаться случайной выборкой; сама постановка вопроса о выборке природной совокупности есть вопрос относительной объективности.,1
Хрупкий.,0
"Звягинит хрупкий, спайность совершенная {001}; под микроскопом видны еще направления средней спайности, приблизительно перпендикулярные как друг другу, так грани.",0
образующими нотогастре тонкие прерывистые полосы.,0
"Смысл ответственность за осуществление, за способ связан потребностью способностью самостоятельно, свой страх риск, строить осуществлять ее.",1
"парами: h (77-86), m, (98-106) и	(77-S6)",0
"Нижние стеблевые листья похожи прикорневые, но мельче.",0
Женские сережки при цветках .,0
", при железистые.",0
Губы низкие.,0
проходящем свете зерна прозрачны.,0
"Листочки оберточки числе линейно-ланцетные, короче цветоножек отсутствуют.",0
"Чашечка трубчато-колокольчатая, 8-9, 15 заметными жилками, более нежелезистыми более короткими железистыми, почти двугубая, тремя слегка сросшимися верхними свободными нижними треугольно-ланцетными зубцами -, верхушке заостренными, но остистыми.",0
"Встречаются поры угловатые, квадратные округлыми углами заостренно-вытянутые.",0
"Существование, – цель живой системы;",1
"Канонеровнт образует тонкую белоснежную корочку гранях кристаллов кварца, топаза касситерита; эта корочка состоит из мелких радиально-пластинчатых агрегатов величиной кристалликов долей .",0
Аксиальная паренхима представлена достаточно обильной апотрахеальной - диффузной скудной паратрахеальной-вазицентрической типами.,0
есть три (как минимум) сложные модусные перспективы; сложные модусные перспективы – сам модус.,1
8-м тергите (7) 8-10.,0
"Листья сверху темно-зеленые, рассеянно",0
раза больше маргинальной .,0
Затылок сглаженной ячеистостью.,0
", крупнозубчатыми.",0
"Если угол между направлением импульса падающего электрона Ро волновым вектором k (о - угол скольжения падающего электрона), условие Вульфа-Брэгга имеет вид вероятности кластера.",1
"Условия коммуникации, точнее - сама коммуникация напряженным, тенсиональным.",1
"Щупики черные, их 1-й слабым сенсорным полем, 2-й короткий, 3-й - узкий  (рис. , ).",0
"Большинство щетинок простые, некоторые наружные (ногах I, П), внутренние (ногах 111, IV) дорсальные - широкие, вогнуто-листовидные, округлые дистально трубчатые у.",0
уже самого начала есть общественный продукт” (цитата);,1
Гомологичными одинаковые хромосомы разных организмов биологического вида.,1
"Спикулы сравнительно крупные широкие, зентрально изогн ты, их -.",0
"Лобное вдавление четкое, небольшое, морщинках  обе стороны продольного киля.",0
"самого выражения «управляющая» следует, она уже сама полноценной, несмотря   управляемый объект находится вне ее.",1
", цельный немного расщепленный.",0
"апелляция объяснительным редукционистским теориям должна рассматриваться регресс психологического знания.""",1
Подстолбия короткоконические; стилодии 0.-0.7.,0
"Контекст -   иное, наше окружение;",1
Внутренние губные сенсиллы форме мелких папилл едва заметны.,0
", верхней мелко шиповатые; пирамидка около 0. .",0
«Основная цель живой системы – существование –» (из цитаты).,1
"исходном наиболее точном смысле слова диалогом живое общение между людьми, участники духовно обогащают друг друга, выражают, преобразуют, развивают свои мысли чувства, вы- рабатывают общую позицию, наоборот, остаются при своих взглядах (теперь уже уточненных) т.  д.  отличие от нее лишь вышеуказанный живой диалог реальных субъектов (современников) исходную наиболее яркую непосредственного общения (лицом лицу) - беседы, дискуссии т.  д. Все многие другие типы диалогических отношений весьма разнообразные проявления социальности,, психики т.  д. Суть своей теории Бахтин выражает следующим образом: «Единственно адекватной словесного выражения подлинной человеческой незавершимый диалог.",1
"Фаринкс мускулистый, слегка расшир ется к своему, но образует терм нального бульбуса.",0
"Аногенитальная область (рис. , ; .",0
"Древесинные лучи многочисленные, слабогетерогенные гетерогенные, одно-трехрядные 20 (26) клеток выс.",0
"Третий усика (флагелломер ) .- .7 раза своей ширины, .8-.0 раза длиннее 2-го, составляет 0.7  ; последнего составляет .0- .0 -гс.",0
"Грудь выпуклая, почти равной, ширины высоты, короче брюшка (43 : 52).",0
"Стебли одиночные числе нескольких, коротко покрытые пленчатыми остатками листьев, -17  выс.",0
", толстоватые, отклоненные.",0
(цитата);,1
Стилодни около 0..,0
"Субкапитулярные простые, представлены",0
"Жить - значит участвовать диалоге» (из цитаты); мнению, «язык, слово -  почти всё человеческой» (из цитаты); мнению, система знаков, подлежащая пониманию, есть первичная данность (реальность) исходная точка всякой гуманитарной дисциплины.",1
Это основном редкие индивиды осколочного облика бутылочно-зеленого цвета.,0
"Анальные (69-82) слабо утолщенные, .",0
"Многолетнее растение 30  высотой, тонким  диаметре стержневым корнем.",0
"Ведь психика – просто система,   суперпозиция, т.е.  взаимоналожение разноуровневых – феноменологической, социальной, психофизиологической др.»",1
"Для агрегатов черта белая, блеск матовый шелковистого, твердость 1-.",0
Просвет фаринкса сильно к тикулизирован.,0
"Ободки ясные, наклонные.",0
Листья -15.,0
"шпица, -12, норме -8, вторичными ринариями базальной (рис.  б).",0
"Лобные слабо головчатые (0.028-0.034), равны 0.7-.0 базального диаметра третьего усиков.",0
"базисной функцией Lz -компонента вектора антиферромагнетизма, равная разности проекции спинов атомов  2 ось z.",1
"-7  шир.), -7-глубокораздельные (/ половины пластинки), широким; нижняя пара лопастей отделена остальных выемкой, расположенной  уровне /-/ пластинки.",0
"Средние верхние стеблевые листья продолговато-ланцетном, белопленчато-окаймлеином влагалище. .",0
"427).  иммерсии бесцветный прозрачный, двуосный (-),отрицательным удлинением пластинок близким к прямому угасанием (cNp = 0-7°, возможно, из-за расщепления кристаллов); ng .459, пр .453, двупреломленне 0.005-0.006.",0
"Такое понимание позволяет рассматривать определенную группу носителей языка, имеющую сходные речеповеденческие проявления, «коллективную языковую личность».",1
Явления наследования размножения - одна сторон жизнедеятельности; предок потомок - взаимосвязанные объекты;,1
", без клювиков (обр. 260, табл.",0
Вторым свойством авторского начала следует назвать степень сложности; ситуацию хочется назвать имитацией авторства.,1
"Панцирь состоит из  типов чешуек (рис. , ).",0
"Ими создается то,   называют генетическим единством органического мира во времени.",1
Сверхфразовое единство замкнутую структуру (даже при наличии нем деиктических элементов).,1
"настоящее время общая теория относительности (О. ТО), являясь общепризнанной теорией гравитации;",1
"I, ).",0
", преобладают двурядные лучи.",0
"Макроскопически давинчиит - минерал тсмно-сирснсвого цвета, тонких сколах под микроскопом бледно-сирснсвый.",0
"Транзитные (переходные) чешуйки редуцированным ретикулум, .",0
Листья -14 (18) .,0
"молодыми побегами; кора ветвей серая; колючки малочисленные вовсе отсутствуют, тонкие, .",0
"сам полезный результат, несомненно, функциональным феноменом, мы назвали всю архитектуру функциональной.",1
"Устойчивые сочетания таком понимании -   иное, бывшие свободные синтаксические построения, окостеневшие результате многократного употребления.",1
"конца пищевода до переднего отдела хвоста кутикула имеет узкие латеральные продольные гребни, составленные из продолговатых склероций, расположенных лате- рально каждом кольце кутикулы.",0
"физике сплошных сред пондеромоторные силы понимаются усредненные времени си­лы, действующие элемент среды обусловленные либо неоднородностью поля, либо неоднородностью среды таковой .",1
клипеусе 9 щетинок.,0
"Коммуникативные фрагменты (К. Ф) - отрезки речи различной длины, хранятся памяти говорящего качестве стационарных частиц языкового опыта он оперирует при создании интерпретации высказываний.",1
", заглубленный.",0
глаза расставлены (расстояние между глазами больше диаметра глаз).,0
", голые, - диам.",0
Волокнистые трахеиды средней толщиной стенок .-.,0
