text,label
Дискурс – речь «погруженная ».,1
"человеческого общения, получающей широкое распространение под влиянием научно-технической революции, многоканальная многократно опосредованная духовная коммуникация. .",1
"перечисленных подходах сознание трактуется нечто, вытекающее опыта индивида, интегратор внутренней  - впечатлений, переживаний, мыслей т.д.",1
"Лапки однокоготкопые, все коготки гладкие.",0
Наше ощущение времени независимой от Бога беспредельной протяженности;   центром Земли служит гроб Господень.,1
"Плоды эллипсоидальные, 13-18.",0
"одновременно единица бытия, объединяющая   е объективно-социальное субъективное, психологическое начало, обладающая своеобразной внутренней структурой орга­низацией.",1
Зонтички.7  диам.,0
"раза больше их ширины, Стигмальная жилка .",0
"Край створки узкий бесструктурный, отогнутый.",0
"Сигнал – материальный носитель информации, служащий упорядочиванию связей системе.",1
Главная габитусная форма кристаллов - пинакоид {001 {.,0
Зонтики -   диам.,0
"Сплавы серии   новое четвертое поколение супермагнитов, широко используемых технологиях прецизионных навигационных приборов устройствах спинтроники"" ""С квантовой точки зрения эффект Капицы-Дирака индуци­рованное комптоновское рассеяние.",1
нерок .9-.,0
"Лодочка немного  шире крыльев фиолетовым пятном  верхушке (, ).",0
", 1984), для Р-модификации ограненные кристаллы нехарактерны.",0
"особые смысловые отношения, их членами лишь целые высказывания, за стоят выражают   я реальные  потенциальные речевые субъекты.",1
кутикуле хвоста грубая кольчатость без латеральных гребней.,0
Контекст - понятие экологическое.,1
"Плоды широко-обратиояйцевидные, плосковынуклые двояковыпуклые, редко слабо-трехгранные, .7-.0.  .-.",0
"3-го слабо головчатые (0.022-0.028), 0.",0
Эпимеральная формула ---.,0
"существу, сплайсинг две последовательные реакции трансэтерификации Р. НК, проходящие автокаталитически либо при помощи ферментов,  рибонуклеопротеидных комплексов – сплайсосом.",1
"Специфика состоит том,   - идеальное отражение, формирующееся развивающееся исторического развития.",1
темя щеки сливающейся пунктировкой.,0
"«Труд,- писал Маркс,- есть прежде всего, совершающийся между природой, своей собственной опосредствует, регулирует контролирует обмен веществ между природой» (цитата); уже отмечалось, идеальное индивидуально- психологическим,   общественно-историческим фактом.   оно  (идеальное) общественно-историческим продуктом;",1
"Двух-трехрядные лучи могут быть без однорядных окончаний короткими, однорядными окончаниями из - клеток, расположенных чаще стороны луча.",0
"Наличник предвершинной блестящей областью, двумя слабыми бугорками переднем крае коротким базальным срединным килем, поверхность наличника гладкая.",0
Явление названо апокампическим разрядом  апокампом;,1
Третий параметр стилистического анализа авторского начала – удельный вес.,1
Носик у бобов.,0
"Ламмерит-Р наблюдается тесной ассоциации эвхлорином NaKCu30(S()), пийпитом KCu()(S04) • McCl, алюмоключсвскитом KCu(Al, Fc)0(S04), аларситом AAs0 ламмеритом Cu((As, Р)0).",0
"Верхние тычинки слегка превышают но верхнюю губу, нижные ей равны.",0
Преклоакльные супплементарш органы отсутствуют.,0
"Брюшко продолговатое (52 : 40), выступающим яйцекладом.",0
Чешуйки воротника куполом асимметричные.,0
"Брюшко серое, без рисунка, дорсально редкими черными.",0
"Темно-коричневая, переднеспинка латерально  .",0
X .7. Пыльники ресничками верхушке.,0
Вычисленная плотность равна .56 г/.,0
Обломки его кристаллов обнаружены только самых ранних пробах отбора (первые  лет после окончания извержения).,0
"Под первыми, понимаются все те случаи, когда какие-либо посторонние живому организму факторы препятствуют полному перемешиванию.",1
"вполне зрелые семянки желтовато-бурые, расширенная их -..",0
"Например, такие выражения различные коммуникативные фрагменты.",1
"А простая, редко разветвленная, З. А имеет 3- ветви.",0
Самец. .0-8.8.,0
Ноги желтые; бедро I слегка зачернено.,0
", обратнояйцевидные, почти цельные, без ноготка, узкой загнутой внутрь верхушкой, одиночным секреторным канальцем, при плодах долго сохраняющиеся.",0
"Ноги слабо головчатыми, 1-м лапок  .",0
тонких сколах прозрачный.,0
"Дорсальные --м тергитах слабо головчатые (0.022-0.028), 0.7-0.8 базального диаметра 3-го усиков.",0
"Далее, всякое общение непосредственной реализацией именно только общественных отношений.",1
"Для эукариот ген можно определить участок Д. НК, образуется функциональная молекула Н. К. Поскольку ряде случаев интроны (или их части) оказывались «кодирующими»,   экзоны «некодирующими», правильнее называть экзонами те участки Д. НК, копии составляют зрелую Р. НК,   интронами те внутренние районы гена, копии удаляются          первичного транскрипта отсутствуют зрелой Р. НК.",1
"Передний глазок удален киля расстояние, равное двум продольным диаметрам глазка.",0
"Подстолбие коротко-коническое, валиком.",0
"Листья голые, прикорневые, черешках - .",0
Скутум крепких дорзальных более мелких акростихальных.,0
"прозрачных шлифах мариинскит имеет изумрудно-зеленый цвет, но более светлый, чем у эсколаита.",0
"Последней особенностью психического отражения, мы считаем важным обратить внимание, то, осуществляя интеграцию ориентацию субъекта во внешнем мире для освоения последнего, качестве своего обязательного звена психика предполагает также освоение учет внутреннего мира субъекта – объективной реальности организма тела.",1
"Г.Г.Филиппова использует термин «интеллектуальная регуляции », функция регуляции – «изменение поведения субъекта соответствии          ситуативными, неповторяющимися изменениями объекта».",1
"Стеклит хрупкий, а очень тонкие листочки гибки.",0
ноготка (рис. ).,0
Епифановит имеет бирюзово-голубой цвет бледно-голубую черту.,0
крыле начало /Ссектора сильно сдвигается жилке сторону М. Р-.,0
"Флаг продолговато-обратнояйцевидный, верхушке выемчатый, 15-23, 8-14.",0
"Прицветники лопатчатые, расширенным,..",0
"Хрупкий, обладает совершенной спайностью  {001} менее совершенной  {010}, излом ступенчатый; твердость  шкале Мооса .5.",0
"первом приближении можно предположить,   изменчивость, наблюдаемая данном уровне организации (материи), есть результат комбинаторики элементов разнообразия предшествующего, более низкого (предыдущего) уровня организации.",1
Ветви темно-коричневые.,0
Твердость шкале Мооса рав 7.,0
-0.8 его базального диаметра.,0
"переднего крыла 24-33 (мода 27), крыла 23-29; брюшка у обоих полов 18-25.",0
"функциональной результат органическую часть, оказывающую решающее влияние ход формирования, так все последующие реорганизации.",1
"Скапус снизу отчетливо двумя килями, нижний киль пластинчатый, верхний слабый.",0
"Растение многолетнее, поликарпическое, темно-зеленое, голое.",0
"сумму структурных отношений, нашедших лингвистическое выражение» (из цитаты);",1
", нами рассматриваются те же средства,   модусе высказывания.   мы бы назвали сложными модусными перспективами.",1
"Древесина (вторичная ксилема) рассмотрена небольших фрагментах, тангентальной радиальной ориентации.",0
Сама природа богодарованной природой.,1
"Соленидии, лапках , ш лапках II, ф голенях III утолщенные, притупленные дистально; другие соленидии  тоньше.",0
",- () шир.",0
"Таким образом, под здесь предлагается понимать фиксированную устную речь..",1
"Крупные среднего размера черные бурые муравьиные львы прозрачными крыльями без рисунка (рис. ),  ).",0
"Колоски одиночные, коротких ножках (веточках могут быть сдвоены), удлиненно-яйцевидные, -.7.",0
"Плоды трудом распадаются  мерикарпия, колонка цельная.",0
"Нередко линейные однорядные лучи имеют - двурядных участка (обр. 262, табл.",0
Смысл стремление наибольшей полнотой реализовать ;,1
"""Термин ""семантический признак"" обозначает ту часть значения определенной содержательной единицы языка (обычно - лексемы), она противопоставлена другой содержательной единице языка, при условии,   достаточно большая часть их значений совпадает.",1
Критерием развития личности служит наличие  отсутствие смысла.,1
"выделенных кристаллах заметны грани призм (110) (010) нередко видна характерная для амфиболов грубая штриховка, вероятно, гранях (110) (рис. ).",0
ширина 0.9.,0
Наука о целях целесообразности – телеология.,1
"Дорзальное субмаргиналыюе ребро хорошо развито пересекается штрихами, между штрихами нижнем вентральном углу чешуйки располагаются поры.",0
"Причина такого странного положения - собственное время сравниваемых популяций, т.е.  дления.",1
"у самцов 0.32-0.36, самок 0.27-0.31.",0
"Плотность, определенная растворе жидкости Клеричи, составляет .25(), вычисленная .25 г/.",0
"Цвет мариинскита очень темный, насыщенно-зеленый, хорошо видимый мелких зернах (.",0
"Прилистники .-12, полусердцевидные,  краю железистопильчатые, голые Черешки 0.  желобчатые, буроватые, сверху.",0
", дуговидно отогнутые (рис. ).",0
"Перед клоакой, зентрал ной стороны кольца кутикулы расширены, чис.",0
"Говорилось,   „сознание"" есть термин очень сбивчивый»; оно понимается главным образом феномен сугубо индивидуальный, связанный накоплением, трансформацией организацией опыта индивида,  проявление духовной связи между людьми.          распространенных трактовок сознания оно определяется совместное знание (Joint or Mutual Knowledge).",1
природе своей диалогична.,1
"Распределение, обусловлено только вкладом К. ЭД, фоном, значительно превышающим эффект, обусловленный Т. Ф. () типа 2 → 3; где Δ - определитель Грама.",1
меньше) при ярком освещении.,0
"изоляция - опять-таки направляющий фактор эволюции,   фактор филогенетической дивергенции"" ""Мейоз – особый тип клеточного деления, результате образуются клетки, содержащие гаплоидный набор хромосом.""",1
"II, ).",0
Случайность здесь понимается беспричинность.,1
"Желобок хелицер переднему краю, покрытыми мельчайшими бугорками (рис.",0
"качестве средств выражения модуса , кроме специфических – заголовков/заглавий, текстовых пробелов, членения абзацы элементы диалога, интонации устно произнесенных текстах под.",1
"внешних губных сенсилл форме тонких, едва заметных щетинок, коло мкм.",0
Вершины нерок,0
Псих формируется своего рода единство физиологических предпосылок социальных средств.,1
"отличие ламмсрита, встречающегося виде хорошо ограненных кристаллов темно-бирюзового цвета (Филатов др.",0
Само расширение выглядит добавление метрическую функцию следующего члена разложения /r.,1
malawi.,0
"Цитик (10 : 28), его ячейки более мелкие чем среднеспинке, Заднеспинка виде небольшой пластинки, глубоких ячейках.",0
"Многочисленные шипики, треугольные, рассеяны но поверхности створки, редко шипики отсутствуют всей створке только ее центральной .",0
"Под дискурсивной                    ью нами понимается разновидность речевой , направленной осознанное целенаправленное порождение целостных речевых произведения.",1
"Каудальные железы имеются, но плохо заметны.",0
"I, ).",0
", выполненные, верхней тонко ребристые, почти щитковидно ветвящиеся слегка дуговидно отогнутыми ветвями.",0
"Основное содержание дления - повседневная борьба за существование,  популяция остается носителем приспособленности.",1
"Из темпоральных щетинок головы присутствуют - наружных вертикальных, внутренняя вертикальная  посторбитальные.",0
Арангасит обнаружен пустотах среди кварц-мусковит-турмалин-суль- фидных жил околожильных грейзенов.,0
", 8-10-цветковые.",0
крупное (величине почти как у Ph.,0
"Фр всегда частью комплекса функций, выполняемых комплексом средств, среди одни играют роль исходных,   другие  - роль среды.",1
"Общественные идеи, взгляды, настроения т.  п. - нечто «витающее» над людьми,   формирующиеся развития общества идеи, взгляды, настроения конкретных людей, живущих действующих конкретных исторических условиях.""",1
", продолговатые,  спинке выпуклые, ребра вальковатые, четко выступающие, комиссура средняя.",0
Коммуникация - линия под напряжением.,1
Мужские сережки . .,0
"черное, жужжальца черные.",0
"Твердость Моосу В1/», микротвердость, измеренная П. МТ- при нагрузке 150 г (тарированном NaCl), 1725 кг (среднее 12 замерам, при разбросе 1681-1771 кг/).",0
где q - приливный заряд.,1
"«монолог значительной степени искусственной языковой » (из цитаты); письменный язык искусственным, графическим изображением устного;   именно: - целенаправленное речевое произведение, состоящее неопределенного количества грамматических структур (предложений) при  имеющее определенный смысл, той  иной степени отличный от смысловых показателей  грамматических структур.",1
"где концентрация мономеров растворе,   ceq - концентрация мономеров растворе при равновесном сосуществовании обеих фаз.",1
"пятый 0.51-0.53, шестой 0.88-0.91 (0.17-0.18 -I- 0.71-0.73), трубочки 0.67-0.74, хвостик 0.38, последний хоботка 0.15, второй лапки 0.17.",0
Единичный акт и есть единство всех трех сторон.,1
Теламон i обнаружен.,0
", зев узкий,  диам.",0
"Цвет минерала темно-коричневый, черта коричневая, блеск сильный стеклянный.",0
Коричневатые. .08.,0
"Эзофастома бокаловилная, вооружена более крупным дорсальным зубом двумя мелкими, едва заметными субвентральными зубами.",0
"«Сознание,-писал Маркс,-с самого начала есть общественный продукт остается им, пока вообще существуют люди» (цитата);",1
"виде механической примеси минерале часто присутствует тонкодисперсный гематит, образующий буроватые сгущения, иногда зональные контуру зерен.",0
(цитата);,1
"Каждый матричный элемент есть свертка соответствующего тока jμ 4-вектором поляризации фотона Aμ"" Известно ,   какая-либо фигура  группа точек называется киральной, т.е.  обладающей киральностью, если изображение идеальном плоском зеркале может ней совмещено.",1
"Можно сказать так: всякое значение есть вместе тем ее функция (в том смысле,   выражение  значения назначение данной), но всякая особая функция той  иной есть особое значение"" ""Развитие антропоцентрической лингвистикиназывают дискурсивным переворотом гуманитарных науках; – наблюдаемая лингвистическая данность моделируемый объект – только основным, связующим звеном между коммуникантами их взаимодействия, но объектом, сущностная природа значительной степени предопределена функцией (из цитаты А.Е.Кибрика);",1
Загиб пологий.,0
"средне-, заднегруди, 2--м брюшных тергитах имеются мелкие полусферические краевые бугорки.",0
"Вычисленная из средних значений пт, ng 2F, эта величина может быть оценена как .722.",0
"непрозрачное, собственной пигментации имеет, светло-серого  бледно-желтого оттенка, зависимости съеденной пиши.",0
"Спереди закруглено сужено, сзади округлено.",0
Фп предпосылку известном смысле причину определенного поведения данной единицы во взаимодействии ее средой.,1
