text,label
"II, /, , ).",0
"Итак, - продукт письменного варианта языка.",1
Под Ю.М. Лотман понимает «...,1
"Макроскопически штуфах минерал непрозрачен, шлифах - иногда прозрачный; обладает стеклянного жирного блеском слабой спайностью (010), хрупок.",0
"Голова плоская, опистогнатическая, выпуклым лбом, черная тонким светлым рисунком - светло-бурыми (у особей белыми) подантеннальными кольцами, полосками глазного канта окантовкой наличника.",0
Смысл - психологический способ переживани осуществления.,1
linkage - средства объединения различных отрезков высказывания.,1
"Таким образом,сообщение, снимается энтропия, порождаемая отдельным предложением.",1
"скорее, здесь коммуникацию диалектической следует понимать так, понимал диалектику Аристотель;",1
Лента л идет внутри левой складки бороздки (рис.,0
Ниже дана более подробная аргументация понятия.,1
"Минерал представлен белыми плотными мелоподобными агрегатами размером (рис. ) крупных пустотах  сростками волокнистых кристалликов, чаще расположенных мелких пустотах среди грейзенов.",0
"Нектарники парные: адаксиальный двулопастный,.",0
"Знаковый материал кода есть   иное, нейрофизиологические следы репрезентативно-двигательных коммуникативных способов передачи информации (жестового, мимического, интонационно- звукового т.д.).",1
"Дарвинизм  теория происхождения видов естественным отбором          основных теорий телеологии состоит трех частей: теории изменчивости живых систем, теории естественного отбора борьбе за существование теории наследственности (генетики).",1
"Бобы ножке, равной чуть чашечки, поникающие, неравнобокие продолговатые, часто несколько изогнутые, 7-13.",0
-8).,0
"Аданальные adx (164-168) заметно расширены срединной, ; ad (114-131), ad (98-110) adA (98-110) слабо расширенные менее опушенные.",0
"Усиковые бугры сравнительно высокие, расходящиеся, срединный лобный бугор слабо намечен.",0
"Коготки короче шпор, но шире сильно изогнуты, расставленные.",0
"“Мое всеоб­щее сознание есть лишь теоретическая того, живой чего реальная коллективность”.",1
",,) округлой формы.",0
Плечевой бугорок.,0
"Измерения голотипа. .16, усики .04-.10, том числе третий 0.84-0.85, четвертый 0.55-0.56.",0
"Цвет образцах зернах под бинокуляром ярко-зеленый изумрудно-зеленого, но порошок бледно-зеленый.",0
"Флагеллум антенн 7,, последний значительно меньших размеров, почти округлый (рис. , ).",0
"Панцири треугольные, четырехугольные, редко овальные.",0
"Проксимальный край широкий гладкий, кромка узкая.",0
Определение « ген – фермент» также оказалось неточным; определение « ген – одна полипептидная цепь» также устарело.,1
клетки.8.,0
"Перфорационные пластинки простые (обр. 260, табл.",0
"Пронотум темно-бурый, без пятен, передние утлы осветлены.",0
"Способность субъекта переживать ценность, удовлетворяться ею составляет смысл.",1
"психологии смыслом (не только , но любого действия, поступка, события т.д.) принято называть внутренне мотивированное, индивидуальное значение для субъекта того  иного действия, поступка, события.",1
",   особую разновидность языкового творческого акта, имеющую свои параметры, отличные от параметров устной речи.",1
"мкм, несущие поры слабо заметным неразличимым окаймлением (обр. 260, табл. ).",0
"Прекубитальное поле переднего крыла простое, без - жилками.",0
"Затылочный киль сверху отчетливый, нижней стороне головы он продолжается острый защечный киль треть расстояния между затылочным килем ротовой ямкой.",0
"().: самец 20-23, самка 19-21; переднеспинка: самец .8-, самка .-.8; надкрылья, самец 18.-19; передние бедра: самец 17-18, самка 13-14.",0
"во-первых, теории социальной                    и, последняя выступает своем отношении объекту реализуемым ней общественным отношениям  категория философско-социологическая без каких-либо попыток перевода план конкретно-психологической интерпретации.",1
"Лирифиссуры im расположены медиальнее отношению к е другие лир фиссуры (га, ip.",0
ультрафиолетовых лучах (X 240-400 нм) нс люминисцирует.,0
Излом раковистый.,0
"Ноги, исключая черные тазики, желтые. .74.",0
"I, /, ) короткими клювиками, расположенными чаще конца.",0
"Имеется 10 пар генитальных,  пары анальных  пары аданальных щетинок.",0
",  срезе слегка сжатые спинки, ребра слегка волнистые, короткокрыловидные килевидные, часто неравные, а иногда некоторые неразвитые.",0
"Несколько неформально модуль развития может определяться подсистема, проявляющая некоторое относительно автономное поведение (von Dassow, Munro, 1999).",1
", сверху голые, снизу слегка, но краю усеянные железками единичными; листочки числе -7 удлиненно-эллиптические, мелкие 14-25.",0
Ванадиопаргасит образует преимущественно гипидиоморфные коротко- длиннопризматические кристаллы размером 0.10-0.80 X 0.05- 0.10.,0
"клетках лучей аксиальной паренхимы обнаружены кристаллы оксалата кальция кристаллический песок (обр. 261, табл.",0
"Кубитоанальное поле переднего крыла однорядное, без добавочных жилок, лишь между А З. А имеется замкнутая пятиугольная ячейка.",0
"Лирифиесуры iad обнаружены.Ноги (рис. , -).",0
"Мендигит оптически двуосный отрицательный, пт= .782(), ng = = .796();",0
", - шир.",0
Фр каждом конкретном случае - реализация некоторой способности данном акте речи.,1
Излом раковистый.,0
"раза превышает, иногда такие слои перемежаются слоями лежачих клеток.",0
"Счастье - скорее состояние, дление.",1
"Ость гладкая 1-, несколькими короткими шипиками.",0
раза превышает диаметр т ла области клоаки.,0
"Поэтому смысл - только будущее, только перспектива, но мера достигнутого, оценка достигнутого своими силами существенным для личности критериям.",1
"объекту способствующий сохранению существования  объекта  той, он входит качестве элемента.",1
"Плотность, измеренная пикнометрически - .01() г/, вычисленная по эмпирической формуле - .001 г/.",0
других концепциях сознание рассматривается соотнесение индивидом своего субъективного опыта          социально-выработанными образцами.,1
СОдействия компонентов получение фокусированного полезного результата.,1
", головка рылец бело-шерстистая.",0
malawi Ph.,0
"Боковые глазки соприкасаются внутренними орбитами глаз, удалены киля  расстояние, равное диаметру глазка.",0
Модус – аккорды модуса пространстве звучащие уже мелодия;,1
чашелистики 25.,0
Из-за совершенной спайности минерала величину пр измерить удалось.,0
"Под дискурсивным мышлением мы понимать особый вид вербального мышления, обслуживающего порождения смыслового восприятия дискурсов.",1
наружному краю гипопигий (рис.,0
"Трубочки составляют (0.17) 0.19-0.24, .8-.",0
"Сознание рассматривается так же, тотальность впечатлений, мыслей чувств, создают личность. - некоторая целостная установка, объединяющая эпизоды умственной индивида.",1
"Прикорневые листья тонких черешках, треугольной очертании, трижды тройчатой пластинкой -7 .",0
"Плотность ванадиопаргасита, измеренная уравновешиванием жидкости Клеричи путем постепенного разбавления, составила .05±0.05 г/, рентгеновская плотность - .112 г/.",0
"чешуйки асимметричные, очень коротким шипом.",0
"Наиболее общим пониманием трактовка конкретно-исторически обусловленного способа существования, бытия.",1
Кустарник невысокое дерево довольно сильно,0
"Многолетник толстым волокнистым корнем корневищем, несущими спящие почки цветоносные стебли.",0
"Таким образом, первая основная особенность высказывания единицы речевого общения - смена речевых субъектов.",1
"Кутикула утолщенная, шагренированная, местами элементами ячеистости.",0
"бедра голени утолщены вершине (рис. ,-), бедра также резко сужены в, а голени постепенно расширяется  к вершине.",0
Минералогия.,0
"Под параметром имеется виду относительное текстовое пространство, отведенное под авторское начало""",1
"Форма пор разнообразна за счет инкрустации породой (обр. 260, табл.",0
"прижато-черново- лосистая, зубцы узкотреугольные, 1.- раза короче трубки иногда равны ей.",0
"Головогрудь овальная, спереди тупо усеченная, гладкая, блестящая, серо-желтая темным головным отделом.",0
"Цвет минерала светло-зеленый, олеск стеклянный, пленках - матовый.",0
"Лицо 7, клипеус без щетинок.",0
Киль между усиковым бугорком глазом хорошо развит.,0
"У диплоидных (полиплоидных) организмов, клетки содержат  (несколько) набору хромосом каждого          родителей, одинаковые хромосомы получили название гомологичных хромосом,  гомологов.",1
", ширина, соответственно, - .-. .7-.8.",0
"Блеск перламутровый гранях н плоскостях спайности, изломе жирный.",0
"центре створки ареолы расположены безпорядочно, периферии образуют короткие радиальные ряды.",0
"Стебли приподнимающиеся  распростертые, нижней слабо  короткими, простыми, прижатыми, белыми, молодом возрасте очень часто примесью черных (рис.).",0
"ih, ips) - позициях, типичных для представителей подрода.",0
"Секреторные канальцы но - ложбинках, комиссуральной стороне -; реберные секреторные канальцы отсутствуют.",0
"Глаза выпуклые, овальные.",0
"Зонтички 11-15-цветковые; листочки оберточки сходные листочками обертки, краю короткошероховатые, короче зонтичка; цветоножки -.",0
"Отдельные кристаллики канонеровита (из сростков) бесцветные, моноклинной сингонии, внешней симметрией 2/т, габитусными гранями 7, ,е малоразвитыми не всегда проявленными ( результатам гониометрических измерений применением столика Федорова; табл.",0
"наш взгляд, смысл - способность субъекта переживать ценность жизненных проявлений своей индивидуальности, своего «я», своей личности.",1
", абаксиальный цельный, более короткий.",0
Продольный диаметр глаза 1.,0
рамках аксиоматики можно определить целесообразное самодвижение  самопокой.,1
"Понятие навигации, изначально сводилось определению курса положения плавательного корабля,  плане можно осмысливать коммуникативную  нахождению значимого «пути».последнее время шире применяется технология так называемой автоматической навигации, осуществляется при помощи спутниковых средств связи - глобальных позиционных.",1
Отношение к крыла .51.,0
"«клавитурщик» – технический создатель, никак выражающий своей позиции обсуждаемым проблемам;",1
"boldyrevi, но отличаются некоторыми перечисленными ниже признаками.",0
"Прицветники .- , обратнояйцевидные продолговатые, верхушке тупые закругленные, бурые, обеих сторон д (опушение изнутри более густое).",0
"Строение следующими особенностями: надкрылья (рис. ,) более, чем у предыдущих видов, существенно заходят за вершины анальной генитальной пластинок (надкрылий приблизительно.",0
"«принцип системности, прошедший естественный отбор временем, радикальным изменением идеологического контекста сменой ключевых фигур нашей психологической науки, может сформулирован виде необходимости психологии многоуровневых объяснений, объединяющих разные уровни причинности.",1
"короткие, - мкм.",0
"(навыки XXI века) понятие описывает набор навыков, обеспечивает согласованность действий интеграцию различных сфер для достижения успеха современном мире.",1
"Например, лексическое понятие слова аптека толкуется «учреждение, изготовляются продаются лекарства» (Словарь Ожегова).",1
"Внешние губные губные объединены круп Хейлостома узкая, укреплена склеротизированными ребрами часто выступает из ротового отверстия.",0
"boldyrevi, а генитальная - промежуточная между таковыми этих видов форме; гениталии (рис.",0
Эндосперм плоский (рис. ).,0
"Хвостик пальцевидный, небольшим сжатием ближе к, 9-14 (рис.",0
Экзокарп семенная кожура из мелких клеток.,0
Теорией стабильности генетика;,1
"Классический пример – изменчивость (разнообразие) химических элементов есть результат комбинаторики элементарных частиц, воплощенных Периодической элементов Д.И. Менделеева.",1
"Гоностиль (рис. ,) короткий,.8 раз больше его ширины, крупный широко усеченной слегка вытянутой к конечному зубцу вершиной, окруженный тонкими группой мелких зубчиков над конечным.",0
Х0.Х. (рис. ).,0
"плоскость, даже емкость, заполненная образами.",1
", наибольшая ширина .8, т.е. - раза превышает ширину.",0
", почковидной, краям мелкозубчатой, верхушке слегка выемчатой долей средней губы .-, - шириной, бородкой.",0
", снизу более светлые, курчавым опушением, черешками - раза более короткими, чем пластинки; листовые пластинки цветущих побегов широкояйцевидные широкоэллиптические, - . -  шир.",0
13-го флагелломера 544-560 мкм;,0
таких колец 27-35.,0
"Эти черви - гиганты сравнению другими видами рода Р. Иаепосош, кроме Р.  polycirra, также имеет большие размеры.",0
"Спайность несовершенная, базальная; отдельность наблюдается.",0
"b, а, а, J6, а, Ь, (65-82) простые,",0
"Верхняя губа, мандибулы базальные",0
"Корневище короткое, стебли плотно скучены.",0
"у, ребристые, почти прямые слегка коленчато изогнутые, простые середины ветвистые, короткими междоузлиями.",0
каждое подобное движение -  коммуникативное событие;,1
"Церки 12-13-члениковые, каждый, кроме - вершинных несет внутренней стороны -3 боковых опорных шипа.",0
", крайне редко .",0
"Микротвердость (П. МТ-, нагрузка 50 100 г) составила 752-824 кг/, среднем (17 замеров) 795 кг/, т.  е.",0
где M - матричный элемент;,1
"современной психофизиологии связей между языковыми элементами разных уровней, образуется сознании ходе речевой биографии влияет воплощения мысли слове, получила название «вербальной сети».",1
Стоматоцисты неизвестны.,0
Цвет порошка минерала (черта) светло-зеленый.,0
К.Ф - целостный отрезок речи;,1
11-12 шир.,0
", черновато- зеленовато-бурые, слабо-блестящие матовые, -расширенными бахромчатыми околоцветными.",0
Сознание существует только обществе плане выступает системное качество.,1
"стебель несет светлые бледно-зеленые слабо охристо-окрашенные чешуевидные листья, верхний из трехгранной внизу плоской вверху узкой пластинкой 10-12 .",0
"Фовеи амфидов форме щели двойным конту ром расположена уровне переднего кольца кутикул Ширина фовей амфидов 7.0-7.мкм, что равня ется 80-85% диаметра данном уровь Слегка впереди фонзей амфидов, субкутикуля ном слое имеются  сильно кутикулизированнг конусов.",0
"Хелицеры (303-315) двумя: chb (77-86) простые, слабо ; cha (8-12) шиловидные, гладкие.",0
Речевые произведения результат дискурсивной языковой личности.,1
"сложный механизм адаптации целостного растения внешним условиям, A.Trewavas  называет «разумным», действительности суммой кооперацией совокупности адаптационных, осуществляемых разными клетками органами искомого растения целом          такой характеристикой мышления животных, способность экстренному решению новых задач (см. ),   также  понятием антиципации способности субъекта избирательно относиться воздействиям среды предвосхищать изменение (см. ).",1
