text,label
"Структура створки из локулярных ареол, локулы цилиндрические, наружным сплошным велумом, крибральные поры расположены свободно, мелкими фораменами внутренней поверхности.",0
"Так, А.А. Леонтьев своих работ писал: """"Общение следует понимать  интериндивидуальный,   социальный феномен; субъект следует рассматривать изолированного индивида,   социальную группу  общество целом.",1
-10 шир.,0
Жужжальца черные.,0
"структура дискурса выступает отражением (и выражением) особенностей языковой личности, том числе – ее коммуникативной компетенции.",1
"Последний хоботка короткий стройный, конце заостренный, равен 0.8-0.9 2-го  лапки, 16-24 дополнительными (рис. \в).",0
"Следовательно, психику необходимо понимать, во- первых, отражение субъектов самого   я внешнего мира,   во-вторых, интеграции отражений системе единого образа, вызревающего поведения () субъекта необходимого для регулирования.",1
"целое обладает собственной предикативностью, отличной от предикативности входящих него компонентов.",1
"Повторяющиеся ситуации взаимодействия членов общества обслуживаются типическими речевой коммуникации, носят название жанров общения.",1
"именно результате диалога коммуникация «превращение внешней внутреннюю всегда творческим Диалог таким образом -  то,   выбирается,     испытывается;",1
Модусы принадлежность отдельных высказываний ипоказатели метатекста особые текстовые «нити»  сплетаются авторский узор;,1
", похожи форме (рис. ,) продорсальные.",0
", шиловидными зубцами 10-15; прицветники, 8-13, .-.0 шириной, темно-бурые; прицветнички ( при чашечки) нитевидные, -8.",0
Хоботок доходит средних тазиков.,0
одуванчик (мотивирующая С. Д производна от дуть) называется еще пухлянкой (мотивирующая С. Д производна от пухлый);,1
"Анальная лопасть развита, округлая.   кинетосом отходят ленты, состоящие из тесно сближенных микротрубочек.",0
встречаются упомянутые выше вторичные минералы.,0
щитке 9 щетинок.,0
"""темный фотон (Т. Ф) A′ - массивный векторный бозон, может смешиваться          обычным фотоном посредством «кинетического смешивания».",1
"Под C можно понимать удвоенную Массу Ч. Д, под C2 - какой-либо зарядов.",1
"где - напряженности электрического магнитного полей; где, р - импульс электрона, v - скорость, энергия; где At - коэффициенты разложения, являющиеся произвольными функциями трехмерного волнового вектора k,   (.c)k = clkl - частота, соответствующая волновому вектору k.",1
"""Функция потенциальном аспекте (Фп) - присущая той  иной единице языковой способность выполнению определенного назначения соответствующему функционированию.",1
Минерал люминесцирует ультрафиолетовых лучах.,0
"Чешуи яйцевидные узкояйцевидные, .",0
"Акростихальных шетинок среднеспинки около 10, они очень короткие начинаются недалеко  границы передней спинкой.",0
"Т.о.  , теоретическая биология – теоретическая телеология  просто телеология, любая наука  учение, состоит          понятий (их дефиниций), законов состояния - покоя (сохранения)  движения (изменения), основанных понятиях законах логических (качественных) математических (количественных) теориях.",1
"Модель модифицированной гравитации стоит рассматривать альтернативу О. ТО; заряд, эффективным проявлением дополнительных измерений.",1
Вычисленная плотность владимиривановита Тултуйского месторождения - .436 г/.,0
"Плотность, измеренная растворе Клеричи - .65() г/, рассчитанная структурным данным эмпирической формуле - .73 г/.",0
Он пишет: «Точные науки - монологическая знания» (из цитаты); вещь субъект (личность) суть принципиально разные предметы познания.,1
. Цепочки вершинной  жгутика усиков 7-9-членико- вые (рис. 7).,0
"Боковые грани пластинок проиндицировать не удалось, предположительно это {100}  {110}.",0
"срезе плоды округло-пятиугольные, экзокарп из мелких клеток, мезокарп из паренхимных клеток.",0
"Соцветие зонтиковидное, () короткими веточками.",0
"Владимиривановит Тултуйского месторождения обладает темно-синей чернильно-синей окраской, как правило, неоднородной пятнистой; цвет черты темно-синий, цвет порошка - темно-синий, чернильно-синий, неоднородный.",0
"Солитоны - волны, локализованные за счет нелинейных механизмов, - обычно разделяются два класса.",1
"случае разреженных сред под пондеромоторными силами часто понимаются усредненные повремени силы, действующие отдельный электрон пространственно-неоднородном электромагнитном поле.",1
"где L - орбитальный момент, ML - проекции ось z, κ - другие квантовые индексы.",1
Наблюдатель здесь - активная сила;,1
Земная -  «суета сует».,1
Спайность совершенная но излом листоватый.,0
Основным условием научного мировоззрения стали объективность независимость явления от наблюдателя;,1
Сам принцип детерминизма может рассмотрен редукции неопределенности.,1
Со-дление  живых взаимодействующих популяций удобно называть сосуществованием.,1
"Поры овальные, овально-вытянутые, довольно крупные, осью, перпендикулярной к оси сосуда, их размер.8-.0 X .  мкм; апертуры включенные, округлые горизонтально-вытянутые, размером 0.8-1.0 0.8-1.",0
возникает...,1
"Многолетнее бесстебельное растение; стрелки -35  высотой, малочисленные, умеренно отстояще- полуприжато-",0
"Щит чешуйки папиллами, (совместно) ребрами формируют ретикулум.",0
"удлиненно-овальное, .24-.20.",0
Узкая пленчатая верхушка чешуи без ресничек краю немногими короткими ресничками.,0
"непонятийные С. Д, входящие лексический фон, мы будем теперь называть их принадлежности - фоновыми С. Д. Речь идет только о степени присутствия некоторого качества: минимум сведений, например, о дереве, Потебне, - ближайшее значение, максимум (ботаническом описании) - дальнейшее.",1
«память есть вечное онтологическое начало».,1
Зубцы чашечки отсутствуют.,0
"Семенник, прямой.",0
", подземной утонченные, сечении округлые, тонкие,.",0
"Прилистники широкосерновидные, малым количеством крупных зубцов, стерильных побегах более крупные.",0
"субъект выступает лишь некая абстрактная, психологически """"не наполненная"""" целостность.",1
", довольно постепенно переходящая носик .-.",0
Ее Темя килем.,0
А). Лента л проходит близко от ленты л (рис. /).,0
"Иногда щеки узкой темной полоской вдоль края, а окраска переднеспинки может быть почти как у Ph.",0
"где ΔG(n) - работа образованию кластера размером n , равная изменению термодинамического потенциала Гиббса при образовании растворе кластера n мономеров.",1
Твердость шкале Мооса Уг-.,0
"«Генетика есть физиология наследственности изменчивости» (Бэтсон, 1906.",1
"Примем,   изменчивость есть свойство любой исследуемой совокупности однородных сущностей (в частности биологических объектов), описывающее их разнообразие объективное явление.",1
Индивидуальное социальное сознании говорящего – характеристики диалектически взаимосвязанные.,1
"Мандибула 3-зубчатая, большим нижним зубцом, ее высота у (.",0
"Продорсум, нотогастр аногенитальная область округлыми поровыми полями диаметром 20.",0
"Передняя дорсальной стороны более выпуклая, разрезе почти треугольной формы, к хвостовой уплощается (рис. ).",0
"Фамулюс (е) конический, короткий.",0
Листочки обертки отсутствуют.,0
"стороны, смысл выражает притязания личности, стремления, потребности, другой ( очень важно) - подтверждением реальных достижений, реальной способности выразить   я .",1
"вершинных щупиков цилиндрические, вершинный .",0
15-18 мкм диам.,0
"Здесь t - время, mp - масса атома, z - вертикальная координата, g - ускорение свободного падения.",1
"Оптическая ориентировка: Ng = а, Nm = b.",0
"Под микроскопом проходящем свете звягинит бесцветный, плеохроирует.",0
"Углубление под передним глазком небольшое, ячеистой скульптурой.",0
", концах закругленные, внезапно переходящие короткое остроконечие.",0
"Биологической изоляции, например, сдвиг гнездового периода во времени.",1
"Мутация – наследуемое изменение генетического материала, сводимое характеристикам генетического материала (генотипа) родителей.",1
"Мандибулы желтоватые, их зубны красноватым оттенком.",0
"чешуйках воротника ретикулум занимает более половины поверхности щита состоит из угловатых ячей, каждая ячея включает пору.",0
Стебли 15-40 см выс.,0
"Цветки одиночные соцветиях -; цветоножки тонкие, железисто-щетинистые, 10-20.",0
"Диск хорошо развит, -  диам.",0
"Имаго, самец.",0
"Индивиды стеклита зачастую разной степени расщеплены, иногда напоминают открытую книгу.",0
"Уникальность языковой личности конкретного индивидуума есть иное, неповторимость комбинации социально- психологических характеристик ее речевого поведения.",1
"Измерения проведены микротвердометре У. И П. МТ- при нафузке 50 г. Все отпечатки сопровождались микротрещинами - «усиками» из-за значительной хрупкости минерала, иногда плоскими асимметричными выколками.",0
"Исходя сказанного, функциональное состояние мозга можно определить кзвено системной реакции организма, проявляющееся виде интегрального динамического комплекса наличных характеристик тех функций качеств нервных структур, прямо  косвенно обусловливают выполнение результатом  - «специальный случай».",1
"Стебелек (10 : 34), продольных резких морщинках, 2-й тергит (26 : 40), продольных, довольно густых морщинках, достигающих % тергита.",0
"Угол V, оцененный кривизне балки разрезе, перпендикулярном оптической оси, составляет 45(10)°, И. ВЫ.",0
"Секреторные канальцы септированные, крупному ложбинке комиссуральной стороне.",0
"Важнейшей единицей такого рода, лежащей основании мнемонического владения языком, мне представляется коммуникативный фрагмент.",1
boldyrevi); его окраска строение похожи таковые Ph.,0
"НК,  одной Н. К».",1
"где Δμ - разность химических потенциалов свободного мономера растворе мономера составе кластера, σ - поверхностное натяжение, r0 - радиус мономера.",1
Преобразование Фп → Фр элемент преобразования потенциальных аспектов языковой реальные языковой их результаты речевых произведениях.,1
Формулы щетинок солен ид иев представлены табл.,0
"Объект (предмет, продукт), имея предметное, внешнее бытие, же время выступает идеальное образование, психический образ, таким путем детерминирует психическую выступает активного вмешательства субъекта мир вещей, отражения предметного мира сознании.",1
лежачих лучевых клеток радиальном срезе -.,0
"Усики 11-члениковые, булава усиков -член иковая.",0
"Цвет препарате.  светлое, только вершины -5-го, -й усиков, вершины голеней, лапки светло-бурые.",0
Конкретное языковое сознание социально детерминированное явление.,1
И (Большое..,0
"Плоды -8, яйцевидно-веретеновидные, светло-коричневые, рыхло войлочно ножках 0.- (рис. , смотри вклейку).",0
"Соленидии ф голенях I 11, а"" коленях I,  коленях II-IV образуют двойную группу шетинкой d.",0
"Нотогастральных щетинок 16 пар (180-217); все они узколистовидные,",0
"морфологическая модульность может рассматриваться также аспект модульности развития (Eble, 2005).",1
malawi Ph.,0
"Генетическая информация о структуре отдельных белков нуклеиновых кислот у всех организмов заключена молекулах Д. НК  Р. НК виде последовательностей нуклеотидов, называемых генами.",1
сосудов тонкостенные толщиной оболочек .8-2.,0
Флаг 8-12.,0
Голень 195-198 сенсиллами.,0
"где - ширина спектра,  средняя частота излучения.",1
Физические оптические свойства.,0
"бедра: самец 25-27, самка 24-25.",0
"О), формирующими полигональный орнамент.",0
Черта белая.,0
Средние голени светлые бурыми продольными полосами бурыми вершинами.,0
"раза больше .36 раза меньше расстояния между глазами, измеренного уровне переднего глазка.",0
"Лепестки белые, .-.",0
Нижняя губа продольная серо-желтая тонкой белой полоской вершине.,0
"Мы уже видели,   для Бахтина взаимосвязи между репликами реального диалога (беседы, дискуссии т.д.) наиболее наглядным простым видом диалогических отношений.",1
"более широком аспекте смысл - ценность одновременно переживание э ценности выработки, присвоения  осуществления.",1
malawi; имеются также мелкие вариации числе жилок их ветвей дорсальном поле надкрылий.Самка.,0
"Точно так же столяр - «рабочий, занимающийся обработкой дерева пилением изделий него», т.е.  любых деревянных изделий,   только «столов».",1
Понятие «социально-эмоциональная компетентность» чаще всего встречается контексте образовательного.,1
", ребристые, короткошероховатые почти голые, немного утолщенные.",0
"Многочисленные, регулярно расположенные штрихи отходят билатерально передних субмаргинальных ребер.",0
"Прилистники яйцевидно-треугольные, островатые, нижней /сросшиеся, -, зеленые, позднее буреющие, нижней стороны  простыми белыми небольшой примесью черных.",0
Эпимеральная область (рис. .,0
Но «слово»...,1
"Пыльники овальные, 0.7, желтые.",0
"""понятие генома отличие от генотипа генетической характеристикой вида целом,   отдельной особи.",1
"Цветки собраны довольно плотный колос -, редко нижние мутовки бывают отставленными основных тогда они сидят коротких ножках пазухах листьев.",0
"Цветоносы равны немного листьев, белыми прижатыми мелкими, очень часто примесью, иногда значительной, черных .",0
"наука об активном отношении общественного миру во всех отношения -  непосредственно производительной, так теоретической, во всех детерминации  отношения.",1
"мкм, ..",0
"Содержанием, труд, потребность также становится ведущих.",1
Створки выпуклые плоской центральной лицевой поверхности.,0
"Стебли многочисленные, 20-35  высотой, восходящие, покрытые чешуевидными коричневыми листьями, короткими более вниз изогнутыми, нежелезистыми, выше иногда значительной примесью коротких железистых.",0
"«Письмо - язык, но всего лишь способ фиксации языка помощью видимых знаков» (из цитаты);",1
Описание.  самцов 8.9-9.,0
"Плотность, вычисленная из эмпирической фор мулы параметров элементарной ячейки, равна .667 г/.",0
"Стебель тупотрехгранный внизу остротехгранный средней верхней, верхушке переходит трехгранный прицветный лист, немного, равен короче соцветия.",0
", средней жилке примесью железок, краю сложно-зубчатые железками концах зубцов.",0
Коммуникативное событие диалог - всегда достижение;,1
точкой обзора угол наклонения.,1
"Плотность, измеренная методом уравновешивания тяжелых жидкостях, составляет 2.88(), вычисленная из структурных данных - .94 г/.",0
фон есть чисто К. ЭД- γe− → e+e−e− может вычислен требуемой точностью.,1
", - ()-лучевые; лучи - .",0
"Диалог - наш символический корпореальный контакт  объектом вне нас, мы пытаемся понять, т.е.  мы пытаемся отнести.",1
"Целесообразность первопринцип биологии представляется синтезом причинности случайности – случайной причинностью  причинной случайностью – особой закономерности, отнятой, «отжатой», живыми системами у случайности дополнительная закономерность.",1
Плеохроизм наблюдается.,0
