0,1
"Под первыми, понимаются все те случаи, когда какие-либо посторонние живому организму факторы препятствуют полному перемешиванию.",1
Стоматоцисты неизвестны.,0
Гааза голые округлые.,0
"Таким образом, коммуникация предстает не как данность, а как заданность.",1
Внутренние губные сенсиллы в форме мелких папилл и едва заметны.,0
"Волоски 3-го членика слабо головчатые (0.022-0.028), 0.6-0.8",0
"Под этим параметром имеется в виду относительное текстовое пространство, отведенное под авторское начало""",1
"427). В иммерсии бесцветный прозрачный, двуосный (-), с отрицательным удлинением пластинок и близким к прямому угасанием (cNp = 0-7°, возможно, из-за расщепления кристаллов); ng 1.459, пр 1.453, двупреломленне 0.005-0.006.",0
Взаимодействие между популяциями есть прежде всего изначальное непрерывное взаимоотражение их статических структур.,1
"Таким образом, контекст - это лингвистическая ситуация.",1
"Таким образом, текст представляет собойсообщение, в котором снимается энтропия, порождаемая отдельным предложением.",1
Экскреторн пора локализуется слегка позади нервного кол ца.,0
Спайность совершенная но излом листоватый.,0
"Лоб с широким желобком, глубина которого составляет 0.20-0.22 расстояния между вершинами усиковых бугров (рис 1 а).",0
В заднем крыле начало /Ссектора сильно сдвигается по поперечной жилке в сторону МР-1.,0
"Соцветие зонтиковидное, с 1(2) короткими веточками.",0
"Интроны – участки ДНК, копии которых удаляются из первичного транскрипта и отсут­ ствуют в зрелой РНК.",1
"Диалог таким образом - это не то, что выбирается, а то что испытывается;",1
"Деятельность - это якобы не поведение, а поведение - не деятельность.",1
Схема абсорбции: Ng > Nm > Np.,0
"Объект (предмет, продукт) деятельности, имея предметное, внешнее бытие, в то же время выступает как идеальное образование, как пси­хический образ, и таким путем детерминирует психическую деятельность.",1
Вычисленная плотность равна 3.56 г/см3.,0
"Стебель тупотрехгранный внизу и остротехгранный в средней и верхней части, на верхушке переходит в трехгранный прицветный лист, который немного длиннее, равен или короче соцветия.",0
Растение 60-80 см выс.,0
"Текст как целое обладает собственной предикативностью, отличной от предикативности входящих в него компонентов.",1
"Это, во-первых, теории социальной деятельности, в которых последняя выступает в своем отношении к объекту и к реализуемым в ней общественным отношениям как категория философско-социологическая без каких-либо попыток перевода ее в план конкретно-психологической интерпретации.",1
"Дарвинизм или теория происхождения видов естественным отбором является одной из основных теорий телеологии и состоит из трех частей: из теории изменчивости живых систем, теории естественного отбора в борьбе за существование и теории наследственности (генетики).",1
"Важнейшей единицей такого рода, лежащей в основании мнемонического владения языком, мне представляется коммуникативный фрагмент.",1
"Гоностиль (рис. 2, 2) короткий, длина в 1.8 раз больше его ширины, крупный с широко усеченной слегка вытянутой к конечному зубцу вершиной, окруженный тонкими щетинками и группой мелких зубчиков над конечным.",0
Крылья.,0
"(Длина тела самцов 8.9-9.2, самок 9.2-12.2, ширина, соответственно, - 2.5-2.6 и 2.7-2.8 мм.",0
"В клетках лучей и аксиальной паренхимы обнаружены кристаллы оксалата кальция и кристаллический песок (обр. 261, табл.",0
"Соцветие многоцветковое, рыхлое, щитковидное; цветоножки и гипантии с курчавым опушением, уменьшающимся но мере созревания плодов; чашелистики яйцевидно-треугольные или широкотреугольные, при плодах приподнятые или прямостоячие; тычинок 18-20; стилодиев 3-5, свободных; плоды шаровидные, небольшие (0.7-0.8 мм в диам.), черные, суховатые.",0
При этом случайность определяется как беспричинность.,1
"Черта белая, блеск стеклянный.",0
"Обертки 11-13 мм шир., довольно узкие, зеленые; наружные листочки обертки от яйцевидных до яйцевидно-ланцетных, прилегающие к внутренним, но краям довольно широкобеловатые, почти перепончатые, с заметными жилками, без рожков, внутренние листочки линейно-ланцетные, без рожков или отчасти с едва заметными рожками.",0
Понятие «социально-эмоциональная компетентность» чаще всего встречается в контексте образовательного процесса.,1
"Похожа на самца, но с передними ногами и генитальной пластинкой примерно как у самки Ph. boldyrevi; яйцеклад короче, чем у последнего вида (в 1.3 раза короче заднего бедра).",0
В ультрафиолетовых и катодных лучах минерал не люминесцирует.,0
"Головогрудь овальная, спереди тупо",0
Описание.,0
"Ноги бурые, с желтым рисунком, в черных редких шипах.",0
"Прилистники широкосерновидные, с малым количеством крупных зубцов, на стерильных побегах более крупные.",0
"По краям лучи обрамляют слои квадратных и короткостоячих клеток, высота которых в 1.2-1.5 раза превышает длину, иногда такие слои перемежаются со слоями лежачих клеток.",0
"Длина тела голотипа 1078, ширина 713, пяти паратипов - 1078-1261 х х 730-780, в среднем 1148 х 750, соответственно.",0
"Скапус снизу отчетливо с двумя килями, нижний киль пластинчатый, верхний слабый.",0
Причем орнамент кутикула на разных участках тела разный.,0
"Передние и задние линии Банкса развиты в обеих парах крыльев, стигмы белесые, хорошо заметны на темном фоне.",0
"Знаковый материал этого кода есть не что иное, как нейрофизиологические следы репрезентативно-двигательных коммуникативных способов передачи информации (жестового, мимического, интонационно- звукового и т.д.).",1
"Такое понимание позволяет рассматривать определенную группу носителей языка, имеющую сходные речеповеденческие проявления, как «коллективную языковую личность».",1
Дискурс – это речь «погруженная в жизнь».,1
"Окончание этого отростка служит источником плазменных «пуль», представляющих собой светящиеся следы распространения волн ионизации, скорость движения которых составляет примерно 200 км/с . Именно она называется апокампом.",1
"Зонтички 11-15-цветковые; листочки оберточки сходные с листочками обертки, по краю короткошероховатые, короче зонтичка; цветоножки 2-5 мм дл., ребристые, короткошероховатые или почти голые, немного утолщенные.",0
Наблюдатель здесь - активная сила;,1
"Бедра всех ног желтые в базальной половине и с желтыми коленками, дистальная их часть бурая.",0
"Г.Г.Филиппова использует термин «интеллектуальная форма регуляции деятельности», функция этой формы регуляции – «изменение поведения субъекта в соответствии с ситуативными, неповторяющимися изменениями объекта».",1
"Иными словами, текст – это не что иное как взгляд на дискурс только с точки зрения внутреннего (иманнентного) строения речевого произведения.",1
"Сознание рассматривается так же, как тотальность впечатлений, мыслей и чувств, которые создают личность.",1
"Пальпы (139-143) четырехчлени- ковые, формула щетинок 0-1-3-10(+1ш).",0
"Но быть подверженным коммуникации - это не то же, что быть повременным ею;",1
"В перечисленных подходах сознание трактуется как нечто, вытекающее из опыта индивида, как интегратор его внутренней жизни - впечатлений, переживаний, мыслей и т.д.",1
"Комплекс Фп, возможных для той или иной языковой единицы и определяющих ее поведение в речи, образует потенциал функционирования языковой единицы.",1
"Популяционные волны - это флуктуации вокруг некой моды, в то время как изоляцией мы называем перерыв или полное нарушение панмиксии;",1
"«Сознание,-писал Маркс,-с самого начала есть общественный продукт и остается им, пока вообще существуют люди» (цитата);",1
"При этом популяция хищника (жертвы) есть не только причина структуры популяции жертвы (хищника), но и следствие.  популяция выступает и как причина и как следствие.  совокупный вещественно-энергетический субстрат организмов популяции остается всего лишь носителем приспособленности.",1
Современный радикальный бихевиоризм трактует сознание как «оперантное обусловливание вербального поведения».,1
"""Развитие антропоцентрической лингвистикиназывают дискурсивным переворотом в гуманитарных науках; текст – наблюдаемая лингвистическая данность и моделируемый объект – является не только основным, связующим звеном между коммуникантами в процессе их взаимодействия, но и объектом, сущностная природа которого в значительной степени предопределена его функцией (из цитаты А.Е.Кибрика);",1
"Длина тела половозрелых червей 3.2- 8.5 мм, наибольшая ширина 3.8 мм, т.е. длина тела в 3-4 раза превышает ширину.",0
"Так, А.А. Леонтьев в одной из своих работ писал: """"Общение следует понимать не как интериндивидуальный, а как социальный феномен; как его субъект следует рассматривать не изолиро- ванного индивида, а социальную группу или общество в целом.",1
Черта белая.,0
Преклоакльные супплементарш органы отсутствуют.,0
"В функциональной системе результат представляет собой ее органическую часть, оказывающую решающее влияние как на ход ее формирования, так и на все ее последующие реорганизации.",1
Киль между усиковым бугорком и глазом хорошо развит.,0
Арангасит обнаружен в пустотах среди кварц-мусковит-турмалин-суль- фидных жил и околожильных грейзенов.,0
Эндосперм плоский (рис. 2).,0
"Это - учение об одной из сторон одного из видов или аспектов деятельности - именно речевой деятельности""",1
"Аданальные щетинки adx (164-168) заметно расширены и срединной части, опушенные; ad2 (114-131), ad2 (98-110) и adA (98-110) слабо расширенные и менее опу шенные.",0
"""С квантовой точки зрения эффект Капицы-Дирака представляет собой индуци­рованное комптоновское рассеяние.",1
"Иногда стеклит формирует, как правило, вместе с эвхлорином, алюмоключевскитом, лаш бейнитом и гематитом, тонкие корочки площадью до 1.5x2.5 см на поверхности вулканического шлака (рис. 1, б).Стеклит с Толбачика прозрачный, бесцветный, в агрегатах белый до сероваго-белого.",0
"Модус текста, в отличие от модуса высказывания, рассматривается почти всегда соотнесенно с конкретным автором (типом авторов), реже рассматривается (как модус высказывания) безотносительно к автору (типам авторов).",1
"Брюшко продолговатое (52 : 40), с выступающим яйцекладом.",0
"Последней особенностью психического отражения, на которую мы считаем важным обратить внимание, является то, что, осуществляя интеграцию и ориентацию субъекта во внешнем мире для освоения последнего, в качестве своего обязательного звена психика предполагает также освоение и учет внутреннего мира субъекта – объективной реальности его организма и тела.",1
"Притяжения и отталкивания – причины движения и развития, зарождения, роста, существования, жизни, старения, распада и смерти материальных систем.",1
Лирифиесуры iad не обнаружены.,0
"Для эукариот ген можно определить как участок ДНК, по которому образуется функциональная молекула НК.",1
Они представляют собой отношение между линиями сложных модусных перспектив.,1
На втором членике лапок 15-24 волоска разной длины (рис.).,0
"Понятие навигации, которое изначально сводилось к определению курса и положения плавательного корабля, в этом плане можно осмысливать как коммуникативную деятельность по нахождению значимого «пути».",1
"Прекубитальное поле переднего крыла простое, без или с 1-2 поперечными жилками.",0
"В отличие от нее лишь вышеуказанный живой диалог реальных субъектов (современников) представляет собой исходную и наиболее яркую форму непосредственного общения (лицом к лицу) - беседы, дискуссии и т. д.",1
"""Термин ""семантический признак"" обозначает ту часть значения определенной содержательной единицы языка (обычно - лексемы), по которой она противопоставлена другой содержательной единице языка, при условии, что достаточно большая часть их значений совпадает.",1
"Глаза выпуклые, овальные.",0
"Фовеи амфидов в форме поперечной щели с двойным конту ром и расположена на уровне переднего кольца кутикул Ширина фовей амфидов 7.0-7.5 мкм, что равн ется 80-85% диаметра тела на данном уровь Слегка впереди фонзей амфидов, в субкутикуля ном слое имеются 6 сильно кутикулизированнг конусов.",0
"Можно сказать так: всякое значение формы есть вместе с тем ее функция (в том смысле, что выражение этого значения представляет собой назначение данной формы), но не всякая особая функция той или иной формы есть особое значение""",1
"Основное содержание дления - это повседневная борьба за существование, в которой популяция остается носителем приспособленности. индивидуальность и целостность - достояние популяции, а не организма.",1
"Это воздействие называется «генетической обусловленностью», «наследственностью».",1
"Желобок хелицер по переднему краю с длинными щетинками, покрытыми мельчайшими бугорками (рис. 1, 2).",0
Тело черное.,0
"Спереди тело закруглено и сужено, сзади округлено.",0
"Щетинки lb, 2а, За, J6, 4а, 4Ь, 4с (65-82) простые, опушенные;",0
"(цитата) . апелляция к объяснительным редукционистским теориям должна рассматриваться как регресс психологического знания.""",1
"Таким образом, результат является неотъемлемым и решающим компонентом системы, инструментом, создающим упорядоченное взаимодействие между всеми другими ее компонентами. сам полезный результат является, несомненно, функциональным феноменом, мы и назвали всю архитектуру функциональной системой.",1
"Лента лЗ хорошо заметна вблизи второй пары кинетосом и представляет собой С-образную структуру из микротрубочек и фибриллярной пластинки, соединенных тонкими фибриллами (рис. 3Л 3Ж).",0
Гонококситы в основании с двумя группами плотно стоящих щетинок.,0
"Отдельные кристаллы под микроскопом и в иммерсии бесцветные, прозрачные.",0
И именно в результате диалога коммуникация как «превращение внешней формы во внутреннюю всегда является творческим процессом».,1
"Такая потребность называется потребностью в самовыражении, в самореализации, в проявлении своего «я», о чем мы еще будем говорить.",1
Сохранение образа сокращенной части действия является условием его сознательности.,1
Он пишет: «Точные науки - это монологическая форма знания» (из цитаты); вещь и субъект (личность) суть принципиально разные предметы познания.,1
Земная жизнь - это «суета сует».,1
"Модель модифицированной гравитации стоит рассматривать как альтернативу ОТО; заряд, являющийся эффективным проявлением дополнительных измерений.",1
"Диалог - это наш символический и корпореальный контакт с объектом вне нас, который мы пытаемся понять, т.е. к которому мы пытаемся отнести себя.",1
Принцип целесообразности является категориальным основанием теоретической биологии;,1
Хрупкий.,0
"Однако в обеих традициях навык рассматривается как образование, формирующееся через тренировку и практику.",1
