0,1
Плечевой бугорок с волосками.,0
"Оно может рассматриваться не только как акт осознанного, рационально оформленного речевого обмена информацией, но и в качестве непосредственного эмоционального контакта между людьми.",1
"Корневище короткое, стебли плотно скучены.",0
Плодоношение - конец VIII-IX.,0
"Другая трактовка состоит в том, что сознание объявляется внутренним знанием или убеждением, которое выражается прежде всего в понимании и оценке своих собственных состояний.",1
Стороны панциря прямые или слегка выпуклые.,0
"Ее длина, измеренная посредине, в 2.7 раза меньше ширины.",0
"""Умственное действие характеризуется тем же: оно также представляет определенное целенаправленное изменение своего предмета Умственное действие есть умение произвести «мысленное» преобразование предмета. предметом моего действия являются звуки речи, а буквы являются только средством обозначения этих звуков;",1
"Стрелки довольно тонкие, голые.",0
"Анальная лопасть развита, округлая.",0
Остальные скпериты груди целиком темно-бурые.,0
Смысл жизни - это психологический способ переживания жизни в процессе ее осуществления.,1
Цвет при жизни.,0
"Клетки очень маленькие, 8-11 мкм длиной, 4-6 мкм шириной, обычно эллипсоидные, с апикальными щетинками и воротником вокруг проксимального конца жгутика.",0
"""Мейоз – это особый тип клеточного деле- ния, в результате которого образуются клетки, содержащие гаплоидный набор хромосом.""",1
"Язык, как и другие знаковые системы, - это не просто заместитель реальных вещей.",1
Явление было названо апокампическим разрядом или апокампом;,1
"Коготки короче шпор, но шире и сильно изогнуты, расставленные.",0
Излом ступенчатый.,0
"Реальной единицей такого общения является, по его мнению, высказывание, принципиально отличное от предложения как единицы языка.",1
"Стебли многочисленные, 20-35 см высотой, восходящие, покрытые чешуевидными коричневыми листьями, опушены короткими и более длинными вниз изогнутыми, нежелезистыми волосками, выше иногда со значительной примесью коротких железистых волосков.",0
Аксиальная паренхима представлена достаточно обильной апотрахеальной - диффузной и скудной паратрахеальной-вазицентрической типами.,0
"Кутикула кольчатая, орнаментирована.",0
"Строго говоря, это («геномные мутации») – модификационные (т.е. ненаследуемые) изменения белков, которые тем не менее влекут за собой наследственные изменения генома.",1
"Интенсиональность и экстенсиональность значения - это, по сути, две стороны данного процесса, свидетельствующие о его целостной и эластичной природе.",1
"Функция данной лексемывыступает не как отдельный самостоятельный объект, а как один из элементов более широкого целого во взаимодействии с другими его элементами.",1
"Мы условно будем говорить о контакте, так как термин """"коммуни­кация” обычно воспринимается как синоним общения и в то же время несет определенную (нежелательную в данном случае) методологическую нагрузку.",1
Узкая пленчатая верхушка чешуи без ресничек по краю или с немногими короткими ресничками.,0
"Брюшко серое, без рисунка, дорсально с редкими черными щетинками.",0
"Здесь t - время, mp - масса атома, z - вертикальная координата, g - ускорение свободного падения.",1
"Хрупкий, твердость около 2.5-3 (по Моосу), спайность слабая по (010).",0
И эту ситуацию хочется назвать имитацией авторства.,1
"Рыльца 0.3-0.7 мм длиной, двулопастные.",0
"Листья голые, прикорневые, на черешках 2-3 см дл.; с ланцетными влагалищами; пластинки 5-8 см дл., 2-3 см шир., в очертании яйцевидные, перистые, с сегментами сидячими или почти сидячими, яйцевидными, до 1.5 см дл., 1 см шир., крупнозубчатыми.",0
Цвет на препарате.,0
"Четыре головные сенсиллы в форме тонких щетинок длиной 2.0- 2.5 мкм, что равно 22-26% диаметра области губ.",0
"""Социально-эмоциональные навыки – это концепция, объединяющая несколько близких по смыслу, но отличающихся по контексту употребления понятий.",1
"Это (навыки XXI века) понятие описывает набор навыков, который обеспечивает согласованность действий и интеграцию различных сфер для достижения успеха в современном мире.",1
Самец (голотип).,0
"Листья 4-6 см дл.; рахис листа волосистый и железистый с немногочисленными изогнутыми шипиками; прилистники хорошо развитые, с длинными заостренными ушками 11-18 мм дл., 3-5 мм шир., сверху голые, снизу слегка опушенные, но краю усеянные железками и единичными волосками; листочки в числе 5-7 удлиненно-эллиптические, мелкие 14-25 мм дл., 8-14 мм шир., при основании клиновидные с длинно заостренной верхушкой, сверху голые или с единичными волосками, снизу опушены, по средней жилке с примесью железок, по краю сложно-зубчатые с железками на концах зубцов.",0
"Индивиды стеклита зачастую в разной степени расщеплены, иногда напоминают открытую книгу.",0
"II, /, 3, 4).",0
"Третий членик в 1.3-1.6 раза длиннее 4-го, равен 0.8-1.0 длины 6-го членика, 1.0-1.3 длины шпица, с 3-12, в норме с 4-8, вторичными ринариями в базальной части (рис. 1 б).",0
"Повторяющиеся ситуации взаимодействия членов общества обслуживаются типическими формами речевой коммуникации, которые носят название жанров общения.",1
"В отечественной психологии под навыком принято понимать действие, доведенное до автоматизма путем многократных повторений;",1
"Таким образом, синтаксический признак - это теоретический конструкт, позволяющий записать синтаксическую информацию (в рассмотренных случаях - информацию об особенностях управления) в сокращенном и обобщенном виде.",1
"В качестве средств выражения модуса текста, кроме специфических – заголовков/заглавий, текстовых пробелов, членения на абзацы и элементы диалога, интонации в устно произнесенных текстах и под., нами рассматриваются те же средства, что и в модусе высказывания. и что мы бы назвали сложными модусными перспективами.",1
"В последнее время все шире применяется технология так называемой автоматической навигации, которая осуществляется при помощи спутниковых средств связи - глобальных позиционных систем. каждое подобное движение - это коммуникативное событие;",1
"Показатели преломления, измеренные в иммерсионных жидкостях (X = 589 нм): Np = 1.626(5), Nm = 1.714(3), Ng= 1.740(5).",0
"Критерием развития личности служит наличие или отсутствие смысла жизни. понятие смысла жизни, или жизненной концепции, которое в известной мере характеризует теоретический способ организации личностью жизни.",1
"Трубка венчика 1.2 см длиной, в верхней части расширенная, изогнутая, довольно сильно выставляется из чашечки, верхняя губа 2.5-3 мм длиной, почти до основания рассеченная на широко-обратнояйцевидные доли, нижняя губа 5-6 мм длиной, с полукруглыми 1-1.5 мм длиной и 2.0-2.5 мм длиной, и почковидной, по краям мелкозубчатой, на верхушке слегка выемчатой долей средней губы 3.5-4 мм длиной, 5-6 мм шириной, с бородкой волосков.",0
В других концепциях сознание рассматривается как соотнесение индивидом своего субъективного опыта с социально-выработанными образцами.,1
"Рылец 2, редко 3.",0
"Говорилось, что „сознание"" есть термин очень сбивчивый»; оно понимается главным образом как феномен сугубо индивидуальный, связанный с накоплением, трансформацией и организацией опыта индивида, или как проявление духовной связи между людьми.",1
"I, 2).",0
"Столбик 0.5-1.5 мм длиной, цельный или немного расщепленный.",0
Твердость по шкале Мооса 2Уг-3.,0
Орешки неизвестны (рис. 1).,0
"Одной из форм человеческого общения, получающей широкое распространение под влиянием научно-технической революции, является многоканальная и многократно опосредованная духовная коммуникация. .",1
"Существование, жизнь – цель живой системы;",1
"Под микроскопом в проходящем свете звягинит бесцветный, не плеохроирует.",0
Это есть три (как минимум) сложные модусные перспективы в тексте; сложные модусные перспективы – это не сам модус.,1
"Ферроиндиалит хрупкий, с раковистым изломом.",0
"Сбоку хелицеры треугольной формы с расширенным основанием, выступающим вперед за пределы головогруди (рис. 1).",0
"«Текст,- пишет он,- это функция времени» (из цитаты);",1
Наука о целях и целесообразности – телеология.,1
"Зс и 4d (32-49) тонкие, гладкие;",0
"Вблизи субмаргинального ребра ретикулум отсутствует, и поверхность щита выглядит гладкой.",0
"""Первоначальное определение «один ген – один признак» оказалось слишком расплывчатым;",1
"Наличник с предвершинной поперечной блестящей областью, двумя слабыми бугорками на переднем крае и коротким базальным срединным килем, поверхность наличника гладкая.",0
"«принцип системности, прошедший естественный отбор временем, радикальным изменением идеологического контекста и сменой ключевых фигур нашей психологической науки, может быть сформулирован в виде необходимости в психологии многоуровневых объяснений, объединяющих разные уровни причинности.",1
"Остальная поверхность головы в мелких ячейках, на фоне которых расположены крупные точки.",0
"Имеется 10 пар генитальных, 2 пары анальных и 4 пары аданальных щетинок.",0
"Многолетник с толстым волокнистым корнем и корневищем, несущими спящие почки и цветоносные стебли.",0
Общение представляет собой многогранный процесс взаимодействия и взаимовлияния людей друг на друга.,1
"Стебелек поперечный (10 : 34), в продольных резких морщинках, 2-й тергит поперечный (26 : 40), в продольных, довольно густых морщинках, достигающих % длины тергита.",0
"Си, изогнута.",0
"Естественны поэтому и такие подходы к определению общения, когда последнее характеризуется как """"процесс проявления личностного отношения».",1
"Теория покоя – статика, теория движения – динамика.",1
"Мотивировка наименования, тот признак, который делается представителем понятия для сознания,-это несомненная СД;",1
"4, 1-3) с эктопарамерами, в профиль похожими на таковые Ph. gran- dis, но наиболее выдающийся сзади выступ эктопарамеров расположен выше (в верхней половине эктопарамеро в), а срединная выемка задней части эпифаллуса почти трапециевидная (но не угловидная и не округлая).",0
"В настоящее время общая теория относительности (ОТО), являясь общепризнанной теорией гравитации;",1
"Солитоны - волны, локализованные за счет нелинейных механизмов, - обычно разделяются на два класса.",1
Не растворим в воде и не флуоресцирует.,0
"Оно представляет собой и отношение людей друг к другу, и их взаимодействие, и обмен информацией между ними, их духовное взаимопроникновение.",1
"Следует также отметить, что прионизация белков и шире – образование амилоидных агрегатов вовсе не обязательно представляет собой патологический процесс.",1
"Спайность совершенная по (001), хорошая по (100) и (010), отдельности не наблюдалось.",0
"Однако общение, как это уже отмечалось нами ранее , достаточно многогранное явление.",1
"II, 2).",0
"Иными словами, психология есть на современном этапе теория деятельности.",1
"Кроющие чешуи светлоокрашенные (палевые), у средней жилки нередко присутствует красно-бурый цвет, который часто сохраняется лишь в виде красно-бурых продольных штрихов; в средней части чешуи расположена выступающая более светлая жилка, выходящая на верхушке из узкого неглубокого выреза в виде ости 5-7 мм дл.",0
"КФ представляет собой единицу принципиально иного порядка; именно коммуникативные фрагменты, то есть целые готовые выражения, являются первичными, целостными, непосредственно узнаваемыми частицами языковой материи.",1
"Такое понимание мышления хорошо выражено Э. В. Ильенковым, подчеркивающим необходимость рассматривать «мышление как деятельность, созидающую науку и технику, то есть как реальный продуктивный процесс, выражающий себя не только в движении слов, а и в изменении вещей» (из цитаты).",1
"Фр всегда является частью комплекса функций, выполняемых комплексом средств, среди которых одни играют роль исходных систем, а другие  - роль среды. тип потенциального соотношения ́система - среда выступает как настоящее актуальное (Фп, требующая связи презентной формы с актуальной ситуацией), другой - как настоящее историческое (Фп, программирующая функционирование данной формы в той среде, которая представлена повествовательным контекстом и ситуацией повествования).",1
"Секреторные канальцы септированные, по одному крупному в ложбинке и два на комиссуральной стороне.",0
"1с (41- 53) дерете новидные, опушенные.",0
Одна из текстообразующих ролей модуса – это также создание автором сложных модусных структур.,1
"Цветоножки не сколько неравные, при плодах слегка утолщенные, 5-7 мм дл.",0
"Голова снизу в густых длинных волосках, размеры которых в 2 раза превышают длину волосков на глазах.",0
"Тело черное, жужжальца черные.",0
Фр в каждом конкретном случае - это реализация некоторой способности в данном акте речи.,1
"В проходящем свете минерал зеленый, без дисперсии и плеохроизма.",0
"Дискурсивная деятельность и, шире, дискурсивное поведение есть способ самовыражения языковой личности;",1
"Кустарник или невысокое дерево с довольно сильно опушенными молодыми побегами; кора ветвей серая; колючки малочисленные или вовсе отсутствуют, тонкие, до 1 см дл.; почки мелкие, шаровидные, 2-4 мм в диам.",0
Створки выпуклые с плоской центральной частью лицевой поверхности.,0
"Колоски одиночные, на коротких ножках (на веточках могут быть сдвоены), удлиненно-яйцевидные, 1-2.7 см дл.",0
Передние голени бурые с тонким светлым кольцом в базальной трети.,0
"То, что мы называем внутренними переживаниями, суть явления, возникающие на поверхности системы сознания, в форме которых сознание выступает для субъекта в своей непосредственности.",1
Постботридиальная и нотогастральные поперечные полосы слабо выражены по сравнению с ювенильными стадиями и видимы только в расчлененных экземплярах.,0
"Язык предстает как иерархия единиц различных порядков; целое, которое мы называем нашим “знанием” языка; которое можно определить как неустойчивую, или динамическую заданность; языковой материал, с одной стороны, существует для говорящего в конкретном и непосредственном виде, как собрание готовых языковых “предметов”;",1
"Законы телеологии - это требования, предъявляемые к в целом (к сумме) и к отдельным ее слагаемым.",1
"Еще один широко используемый термин – некогнитивные навыки – пришел из экономических исследований, где под ним понимается все, что не относится к рациональным аспектам принятия экономических решений . его можно определить как «все, что не интеллект»;",1
"Прицветники 1.6-3 мм длиной, обратнояйцевидные или продолговатые, на верхушке тупые или закругленные, бурые, с обеих сторон опушенные длинными волосками (опушение изнутри более густое).",0
